Headline,Body ID,Stance
Dumped woman spends a week in KFC to get over ex,1819,unrelated
The Force Awakens News: Director J.J. Abrams Eyes Summer Release for Star Wars 7 Because of Too Many Spoilers,1966,unrelated
ISLAMIC STATE BEHEADS MISSING AMERICAN JOURNALIST JAMES WRIGHT FOLEY,1034,unrelated
Report: US Drones Over Syria Looking for ISIS Leader Abu Bakr al-Baghdadi,1437,unrelated
BREAKING: ISIS Beheads American Journalist James Wright Foley,11,unrelated
ISIS militants appear to behead abducted American journalist James Wright Foley in graphic video,938,unrelated
Kim Jong-un ‘is so fat from eating cheese that he has broken his ankles’,1837,unrelated
"Sick Kansas City man said not to have Ebola, U.S. plans new steps to fight virus",1905,unrelated
"UBS survey finds 10% of consumers want a smartwatch, expects 24M Apple Watch sales in fiscal 2015",1149,unrelated
Judd Nelson rebuffs Internet rumors that he died of a drug overdose.,115,unrelated
Islamic State fighters training to fly captured jets — watchdog,524,unrelated
Confusion as Cuba’s Castro mourned instead of Kenya’s Fidel,47,unrelated
Does Vogue's New Office Have a Rat Infestation?,944,unrelated
Rajasthan: Angry mob teaches rapist a lesson; chops penis off,2115,agree
J.J. Abrams Asks Disney To Move Up 'Star Wars: The Force Awakens' Release Date,119,unrelated
Meteorite Leaves House-Sized Crater in Nicaragua’s Capital,682,unrelated
"In Vogue vs Rats War, the Rats Are Winning",2072,discuss
British rapper a suspect in ISIS beheading,975,unrelated
"Christian Bale passes on role of Steve Jobs, actor reportedly felt he wasn't right for part",1843,unrelated
"If you really believed Colorado KFCs were selling pot, here’s a reality check",2034,unrelated
"David Haines Beheaded By ISIS, Execution Video Contains Threats Against UK: Reports",1301,unrelated
Nicaragua asks U.S. for help investigating meteorite crater,1179,unrelated
NYC High School Student Nicknamed ‘Teen Wolf’ Made $72 Million On Stock Market,1906,unrelated
"Prankster Gives Homeless Man $100, Secretly Follows Him And Learns He Buys Food For Others",467,unrelated
Kim Jong-un relying on ‘cobra wine’ after problems with trouser snake,625,discuss
Islamic Militants Post Video Claiming to Show Beheading of U.S. Journalist,195,discuss
Mohammed Islam Denies Making $72 Million From Stock Market Trading,1024,unrelated
Report: Former Baseball Star Jose Canseco Accidentally Shot At Home,1906,unrelated
"Gill Rosenberg, Canadian-Israeli Woman Feared Kidnapped By ISIS, Says She's Safe",1330,discuss
Report: Exec popped for $300k dinner after run at blackjack,2111,discuss
Seven teenage girls get pregnant on school trip,1981,unrelated
'They ate through the ceilings and pooped on the keyboards': Rats are 'taking over' Vogue's new World Trade Center office and Anna Wintour 'no longer wants to work there',2045,unrelated
This Is a Truly Horrifying Story About a Spider,214,unrelated
Nigeria and Boko Haram 'agree ceasefire and girls' release',402,unrelated
"Source: Pot in NYC may soon net just a ticket, not arrest",775,unrelated
"Boko Haram denies cease-fire, leader says he married off kidnapped girls",304,unrelated
Gateway Pundit,1303,unrelated
Mexican investigators fear mass grave might hold 43 missing students,295,unrelated
Watch US Marine get shot in HEAD by Taliban sniper - and live to tell tale,2389,unrelated
David Haines beheading video confirmed genuine; UK PM Cameron vows to hunt down ISIS 'monsters',1301,unrelated
Chinese advised to choose British-sounding names to get ahead,137,unrelated
Who Is Michael Zehaf-Bibeau? Ottawa Shooter Suspect Identified By Canadian Officials ,2214,agree
Judd Nelson isn't dead; report is a hoax,725,agree
DNA tests prove Lebanon IS holding ISIS chief al-Baghdadi's ex-wife and daughter after they were caught with fake passports,720,agree
Utah Man Hospitalized After Winning Eggnog Chugging Contest,2509,unrelated
"White House Fence-Jumper Overpowered Secret Service Officer, Ran Through Much of Main Floor",263,unrelated
Two blokes dared to eat 20-year-old burger for charity,225,unrelated
Alleged audio of Michael Brown shooting has surfaced,1104,unrelated
British Man Slaps People If They Sneeze In Public,633,unrelated
Iraq Says Arrested Woman Is Not The Wife of ISIS Leader al-Baghdadi,530,unrelated
"Vogue's Anna Wintour Pissed Off With New 1 World Trade Center Offices, Infested With Rats",2520,discuss
Mystery man slaps shoppers around head for sneezing,1125,unrelated
Government fires employee who skipped work for 24 years,2096,unrelated
Zack Snyder’s ‘Batman V Superman: Dawn Of Justice’ Stolen Batmobile Rumor Put To Rest,8,unrelated
Durex on Rumored ‘Pumpkin Spice’ Condom: No Comment,609,unrelated
Kim Jong-un So Fat He Injured His Ankles,2141,unrelated
Iraqi Official Dismisses ‘Unfounded’ Reports That ISIS Fighters Have Ebola,720,unrelated
"Viral Video Of Homeless Man Spending $100 On Food For Other Homeless Was Faked, Witness Says",2472,unrelated
REPORT: The Batmobile Might Have Been Stolen In Detroit,87,unrelated
"Spider burrowed into appendix scar, crawled through WA man's body",1579,discuss
Macaulay Culkin Dead: Internet Death Hoax Claims Actor Found Dead In Apartment,1423,unrelated
"'American bombing had signed my death certificate': Missing US journalist James Wright Foley goes unflinching to his death as ISIS behead him in horrific video, as a warning to Obama",2261,unrelated
CNN Expert on Brown Audio: At First I Thought ‘Someone’s Trying to Punk CNN’,195,unrelated
"Insiders Claim Steel Apple Watch to Start at $500, Gold at $4,000",1598,unrelated
DHS: GOP Rep.’s Claim ISIS Members Caught at U.S. Border ‘Categorically False’,1689,unrelated
Pope Francis turns out not to have made pets in heaven comment,1835,unrelated
US probing claims ISIS fighters seized airdropped weapons meant for Kurds,2336,unrelated
Ebola Outbreak 2015 Update: ISIS Fighters May Have Contracted Deadly Virus,2463,unrelated
Saudi cleric condemns snowmen as anti-Islamic,1498,discuss
More than 200 kidnapped Nigerian girls to be released after deal reached with Boko Haram,1439,unrelated
ISIS Executioner 'Jihadi John' Is Named as Mohammed Emwazi,2328,unrelated
Mexico finds 4 more graves at site of suspected student massacre,61,unrelated
Surreal Photos of Fisherman’s Jaw-Dropping Catch Will Likely Have People Wondering If It’s Real,1183,unrelated
Kidnapped Nigerian schoolgirls: Government claims ceasefire deal with Boko Haram that will bring missing girls home,125,unrelated
The Guy Who Said a Spider Burrowed Under His Skin? Experts Say…,2297,unrelated
WHO says reports of suspected Ebola cases in Iraq are untrue,1821,unrelated
DNA test confirms child is IS head Abu Bakr al-Baghdadi's daughter,682,unrelated
"Rumor: Stainless Steel Apple Watch Will Cost $500, Gold $4,000",648,unrelated
Rep. Duncan Hunter: 'At Least 10' ISIS Fighters Caught at Mexican Border,1890,discuss
Ottawa shooting: Sergeant-at-arms Kevin Vickers hailed a hero for shooting rampaging gunman,1472,discuss
Weaponized Ebola? ISIS Militants Said To Contract Deadly Virus,1948,unrelated
Apple's 12-Inch Retina MacBook Air Shown in Artist's Renditions,1863,unrelated
Son pays off his parents' mortgage in a heartwarming Christmas video,648,unrelated
Italian catches huge wels catfish; is it a record?,612,unrelated
"No, Banksy Didn't Create That 'Charlie Hebdo' Tribute Cartoon, But That Doesn't Mean You Can't Appreciate It",1034,unrelated
Meteorite strike in Nicaragua puzzles experts,1900,unrelated
"Insiders Claim Steel Apple Watch to Start at $500, Gold at $4,000",2365,discuss
Terror Leader Ahmed Abdi Godane Killed in U.S. Strike,1543,unrelated
"Apple's New MacBook Will Be A Thinner, Cleaner, Faster 12-Inch MacBook Air",1730,discuss
"In New York City, Marijuana May Mean Ticket, Not Arrest",2307,unrelated
Somalia Shebab chief Ahmed Abdi Godane likely dead in US strike: Source,1931,unrelated
Continuing Violence Puts Boko Haram Ceasefire In Jeopardy,1906,unrelated
"North Korean leader Kim Jong-un not missing, just having ankle surgery",2022,discuss
This Kid Made $72 Million During Lunch,2278,unrelated
Isis militants claim to have killed US journalist James Foley,704,unrelated
Seth Rogen to Star as Steve Wozniak in Sony's Steve Jobs Biopic [Updated],1572,unrelated
Seven girls fall pregnant after five day school trip in Bosnia and Herzegovina,313,unrelated
Judd Nelson Death Hoax: FOX News Impersonator Claims Actor Found Dead In Los Angeles Condo,944,unrelated
"Catholic Priest Dead For 48 Minutes, Is Miraculously Revived – His Revelations About God Are Even More Shocking",719,unrelated
Meteorite strike in Nicaragua puzzles experts,1795,unrelated
"Apple Media Event Rumored for Late February, Apple Watch and 12"" MacBook Air Likely Topics [Updated]",1921,unrelated
"Kevin Vickers, Sergeant-At-Arms, Shoots a Shooting Suspect in Ottawa; Called a ‘Hero’",1002,unrelated
Two blokes dared to eat 20-year-old burger for charity,950,unrelated
Rumors about Fidel Castro’s death again circulate on the Internet,545,unrelated
Homeland Security: No ISIL fighters on U.S. border,80,unrelated
WHO ‘probing’ whether ISIS fighters got Ebola,1938,unrelated
DHS: GOP Rep.’s Claim ISIS Members Caught at U.S. Border ‘Categorically False’,80,unrelated
"Vice Media Chief Said to Pay $300,000 for Dinner for 30",682,unrelated
Kim Had Ankle Surgery:  Source,524,unrelated
Crank-Boosting Behind Top Apps in App Store,2407,unrelated
Video Purports to Show Beheading of American Journalist,1347,unrelated
#HairGate: iPhone 6 Customers Are Complaining That The Phone Is Ripping Out Their Hair,1923,unrelated
Has The Batman Vs. Superman Batmobile Been Stolen In Detroit?,1338,unrelated
A Man Says Comcast Called His Boss And Got Him Fired After He Complained About Its Service,2447,unrelated
Boko Haram denies it has agreed ceasefire,125,unrelated
"Six months after abducting Nigerian schoolgirls, Boko Haram reportedly wants to free them",2463,discuss
Report: Possible audio tape of Michael Brown shooting,2313,unrelated
US probing claims ISIS fighters seized airdropped weapons meant for Kurds,816,unrelated
Nigeria and Boko Haram 'agree ceasefire and girls' release',821,unrelated
Identity of ISIS terrorist known as 'Jihadi John' reportedly revealed,1256,unrelated
US Lawmaker: Ten ISIS Fighters Have Been Apprehended Coming Across Southern Border (Video),2367,discuss
"L. Jinny? Abdel-Majed Abdel Bary, UK Rapper, Suspected in James Foley Killing: Reports",2314,unrelated
Magic mushroom found growing at Buckingham Palace,1184,unrelated
Nigeria announces truce with Boko Haram; fate of schoolgirls unclear,800,unrelated
ISIS executioner 'Jihadi John' identified as Mohammed Emwazi,1569,unrelated
ISLAMIC STATE BEHEADS MISSING AMERICAN JOURNALIST JAMES WRIGHT FOLEY,1857,unrelated
Omsk schoolboy turned into a man-magnet after shock,844,unrelated
"US hostage 'murdered' by militants in Yemen, says Hagel",2495,discuss
Report: Exec popped for $300k dinner after run at blackjack,2141,unrelated
"Six months after abducting Nigerian schoolgirls, Boko Haram reportedly wants to free them",1295,unrelated
Moment U.S. Marine is saved by his Kevlar helmet as Taliban sniper bullet hits him in head,1734,agree
Conflicting reports on alleged IS capture of Canadian woman,1295,discuss
HBO Reportedly in Talks with Apple for Launch of New Unbundled Streaming Service,2434,unrelated
"Nun Complains Of Stomach Pains, Later Gives Birth To Baby Boy",1480,unrelated
UPDATE: BATMAN v SUPERMAN Batmobile Reportedly Stolen By (Shocker!) Detroit Locals,1751,discuss
Alleged audio of Michael Brown shooting released,1817,discuss
"Boko Haram Could Release Kidnapped Girls, Nigerian Officials Say",304,unrelated
Report: British intelligence has identified Foley's killer,1263,unrelated
CNN Airs Alleged Audio from Michael Brown Shooting,1435,unrelated
[UPDATED] 11 Men and 0 Women on Tonight's ESPN Domestic Violence Panel,2375,unrelated
$YUM Serving Up #Marijuana & Fried Chicken,1973,disagree
Conde Nast's rat problem at One World Trade Centre: From red carpets to rodent droppings,2072,discuss
"Apple Watch to Be Shower-Proof, Have 100,000 Apps at Launch: Reports",2421,unrelated
Has Ebola infected Isis militants in Mosul?,2187,unrelated
Luke Somers 'killed in failed rescue attempt in Yemen',964,unrelated
Michelle Obama’s face blurred by Saudi state television,396,unrelated
Lawmaker Says ‘At Least 10′ Islamic State Fighters Have Been Captured at the Southern U.S. Border,220,unrelated
Ski Resort Opens With Snow Stored From Last Season,27,unrelated
Second person rushed to hospital with Ebola symptoms after contact with 'patient zero' Thomas Duncan,2020,unrelated
"BREAKING: Islamic State, in video, beheads American journalist James Wright Foley who was kidnapped in 2012 -@BNONews",1569,unrelated
Islamic State Militants Claim to Have Beheaded US Journalist James Wright Foley,1034,unrelated
Islamic State claims it executed American photojournalist James Foley,2047,discuss
America's oldest time capsule unearthed at Boston statehouse after being buried in 1795 by Sam Adams and Paul Revere,1820,unrelated
Elderly Woman Arrested for Kidnapping Neighbor’s Cats & Making Fur Coats,267,unrelated
Amazon's first brick-and-mortar store said to open in Manhattan,1948,unrelated
Macaulay Culkin dead: Actor is victim of another death hoax,2326,agree
Iraqi media says ISIS militants have contracted Ebola,1899,unrelated
Real-life Magneto boy 'becomes living magnet' after getting massive electric shock from street lamp,1966,unrelated
Pure Evil: Islamic State Beheads American Journalist James Wright Foley,170,discuss
Islamic State killer 'Jihadi John' named as Mohammed Emwazi,2165,agree
Mass grave found after 40 students disappear in Mexican protest,295,unrelated
Setting the record straight on tor,2178,unrelated
"David Haines Beheaded By ISIS, Execution Video Contains Threats Against UK: Reports",530,unrelated
"Batmobile stolen in Detroit? Good one, joker!",1673,unrelated
Guantanamo detainee freed in Bowe Bergdahl swap 'back to terrorism',366,unrelated
ISIS Appears To Behead American Photojournalist In YouTube Video,2130,unrelated
News sites fall for Putin bird-dropping video,2502,unrelated
North Korea directive reveals apparent ban on sharing Kim Jong-un’s name,2045,unrelated
ISIS Executioner 'Jihadi John' Is Named as Mohammed Emwazi,2349,agree
Mystery man slaps shoppers around head for sneezing,244,unrelated
Christian Bale Won't Play Steve Jobs After All,919,unrelated
Kurds fear Isis use of chemical weapon in Kobani,1968,unrelated
Has Ebola infected Isis militants in Mosul?,1821,unrelated
Small Meteorite Strikes in Nicaragua's Capital City of Managua,1622,discuss
Small red book among finds in 113-year-old Boston time capsule,419,unrelated
"Rats at Vogue's NYC offices - watch your step, Anna Wintour",387,unrelated
Amazon is about to open its first-ever physical store in New York City,986,unrelated
YPG Confirms: Gill Rosenberg Not Captured in Kobani,1299,unrelated
Hope Fades for Girls' Release After Boko Haram 'Truce' Breached,2192,unrelated
ISIS Extremists Claim to Behead British Hostage David Haines,1155,unrelated
Newly Discovered Mass Grave Linked to Missing Mexican Students,1825,unrelated
"Want a Gold Apple Watch? All You Need is $5,000",2365,discuss
Questions raised over Nicaragua 'meteorite',816,unrelated
ISIS Border Crisis: DHS Chief Says Terrorists Not Entering US Through Mexico,1946,discuss
"No, there aren’t any Ebola cases in Iraq",1461,unrelated
How Canadian Sergeant-at-Arms Kevin Vickers killed shooter in parliament,139,unrelated
Accountant Claims Comcast Got Him Fired From His Job for Reporting a Customer Service Issue,1355,unrelated
IS Fighters Seize Weapons Cache Meant for Kurds,1239,unrelated
Jihadi John UNMASKED: Islamic State killer NAMED as west Londoner Mohammed Emwazi,1939,discuss
Islamic State claims to have beheaded American journalist,1206,discuss
Officials shoot down congressman's claims ISIS terrorists are running across US-Mexico border,2093,discuss
DNA tests prove Lebanon IS holding ISIS chief al-Baghdadi's ex-wife and daughter after they were caught with fake passports,1913,unrelated
"McDonald’s Removing Big Mac, Apple Pies And Eliminating Large Size Options",1938,unrelated
Brian Williams slams social media for speculation weatherman Mike Seidel relieved himself on air,1178,unrelated
"Boko Haram Cease-Fire: Abducted Nigerian Schoolgirls To Be Released, Officials Say",2314,unrelated
Web of confusion as scientists cast doubt on man's claims that a spider burrowed into his stomach through his SCAR,1375,unrelated
Bunbury local discovered a spider had burrowed under his skin on Bali holiday,2459,unrelated
Purdon Ebola Hoax: ‘Texas Town Quarantined After Family Of Five Test Positive For The Ebola Virus’ Article is Fake,409,unrelated
Strange mark turns out to be tropical spider burrowing under vacationer's skin,1500,unrelated
ISLAMIC STATE BEHEADS MISSING AMERICAN JOURNALIST JAMES WRIGHT FOLEY,1897,unrelated
Report: Israeli-Canadian woman fighting Islamic State has been kidnapped by terror group,214,unrelated
"Nun Complains Of Stomach Pains, Later Gives Birth To Baby Boy",706,discuss
"Op-Ed: Hoax – Priest who never existed claims he died, saw female God",615,unrelated
"Seven High School Girls Get Pregnant On Five-Day School Trip, Parents Outraged",2103,discuss
Woman Stays In KFC For A Week To Get Over Her Break-Up,2061,unrelated
Rapper Big Bank Hank of Sugarhill Gang dies at 57,105,unrelated
Meteorite leaves crater in Nicaraguan capital Managua,10,unrelated
Bali Awry,1531,discuss
Speeding Up ‘Seinfeld’ For Younger Viewers,1686,unrelated
"Jeh Johnson: Politicians Shouldn't 'Feed The Flames Of Fear' Over ISIS, Ebola",108,discuss
BREAKING: Soldier shot at War Memorial in Ottawa,1253,unrelated
ISIS fighters ‘have contracted Ebola’,1385,unrelated
Woman Stays In KFC For A Week To Get Over Her Break-Up,1473,unrelated
"Boy, 16, secretly films sex with teacher then uploads it to WhatsApp",1608,unrelated
Canadian Soldier Shot At Ottawa War Memorial: Report,1795,unrelated
"Planetary Alignment On Jan 4, 2015 Will Decrease Gravity For 5 Minutes Causing Partial Weightlessness",1481,unrelated
Nigeria Boko Haram blamed for raids despite truce claim,244,unrelated
More than 200 kidnapped Nigerian girls to be released after deal reached with Boko Haram,2356,discuss
"Managua explosion not a meteorite, NASA suggests",586,unrelated
Rumors of ISIS leader's death debunked,789,unrelated
SEE IT: California homeless man uses $100 gift to give food to others,643,unrelated
"Prankster Gives Homeless Man $100, Secretly Follows Him And Learns He Buys Food For Others",1922,discuss
[UPDATED] 11 Men and 0 Women on Tonight's ESPN Domestic Violence Panel,1364,unrelated
Spider burrowed through tourist's stomach and up into his chest,859,unrelated
"A message from Jim's mom, Diane Foley:",2450,agree
Alleged Ottawa gunman: What we know so far about Michael Zehaf-Bibeau,2256,unrelated
Terrorism fears rise amid reports of stolen jetliners,2309,unrelated
Jilted lover spends a week in KFC to try and get over her ex,1819,unrelated
That Was Fast: Christian Bale Bails on Steve Jobs Biopic,1841,agree
"Apple Reportedly Preparing 12-inch MacBook Air, Thinner and Lighter than Existing Models",385,unrelated
Audio of gunfire in Michael Brown case authenticated by app company,121,unrelated
WAS NBC METEOROLOGIST MIKE SEIDEL PEEING IN THE SNOW ON CAMERA? A TESTY BRIAN WILLIAMS EXPLAINS,633,unrelated
Watch: ISIS Claims to Have Captured U.S. Airdropped Weapons,1785,unrelated
Mystery woman behind the 'richest hands on the internet' revealed: Former pornstar 'makes $5m a year unwrapping Disney toys on YouTube',229,agree
"Apple Watch Pricing to Reportedly Start at $500 for Stainless Steel, $4,000 for Gold",1598,unrelated
Islamic State May Have Fighter Jets Now After Seizing Russian-Made MiGs,819,unrelated
"ISIS Unleash ""Scorpion"" Bombs In Iraq",776,agree
Dog abandoned at Scottish rail station with suitcase full of belongings  Read more: http://www.ctvnews.ca/world/dog-abandoned-at-scottish-rail-station-with-suitcase-full-of-belongings-1.2175026#ixzz3O9Shc1IO,1853,agree
A really devoted man spent $460 on surgery for his constipated goldfish,2280,unrelated
Mexico checks if 43 missing students in mass grave,1740,unrelated
"Why the Gold Apple Watch Edition Must Cost $10,000",305,unrelated
Rumor debunked: RoboCop-style robots are not patrolling Microsoft's campus,0,unrelated
Government fires employee who skipped work for 24 years,1162,agree
Rumor debunked: RoboCop-style robots are not patrolling Microsoft's campus,1169,unrelated
Video messaging service verifies timing of CNN audio recording,456,discuss
Officials shoot down congressman's claims ISIS terrorists are running across US-Mexico border,385,unrelated
Christian Bale In Talks To Play Steve Jobs In Sony's Next Biopic,1296,unrelated
Banksy's illustrated response to the Charlie Hebdo attack isn't by Banksy. But it is striking,730,unrelated
Google to Buy Redwood City Offices for $585M,993,unrelated
Brian Williams Insists NBC News Meteorologist Did Not Pee in the Snow While on Air,775,unrelated
Ferguson riots: audio may have captured Michael Brown shooting,2313,unrelated
Comcast Declares War on Tor?,569,discuss
South Korea: Kim Jong Un had ankle surgery to remove cyst,1837,unrelated
Blundering boyfriend burns down college after trying to impress his girlfriend with elaborate marriage proposal,1592,agree
SEE IT: California homeless man uses $100 gift to give food to others,1130,disagree
HORROR: ISIS Fighters Have Reportedly Contracted Ebola,1615,discuss
NASA Raises Doubts About Reports of Nicaraguan Meteorite,1661,discuss
New Audio Recording From Ferguson May Capture Michael Brown Shooting,1817,discuss
American Predator Drone Circling Islamic State’s Stronghold,1400,unrelated
"Man chops off his own penis, throws it in the trash after getting dumped for bad bedroom skills",1905,unrelated
Pentagon: death of al Shabaab leader in U.S. strike would be major blow,882,unrelated
ISIS Militants Allegedly Contracted Ebola,1982,unrelated
Unconfirmed Reports Say UK Hostage Held By ISIS Found Innocent,2241,unrelated
"Tiger Woods PED, PGA Tour Suspension Allegations Retracted by Dan Olsen",714,unrelated
Militant Group Says It Killed American Journalist in Syria,1982,discuss
SEND IN THE DRONES: Predator drones flown over IS headquarters in Syria,1658,unrelated
We took a look at the photo said to show the body of Islamic State leader Abu Bakr Al-Baghdadi (right) and found it was really an ethnic Albanian militant killed in 2013,1634,discuss
"Lady on FB: I'm 41, Intersex, and Fucked Michael Phelps on First Date",1296,unrelated
ISIS fighters ‘have contracted Ebola’,568,unrelated
REPORT: Apple Isn't Happy With The Battery Life Of Its New Smartwatch,816,unrelated
Mohammed Emwazi: Man identified as Isis killer 'Jihadi John' was 'stopped by MI5' while on safari holiday in Africa in 2010,2033,unrelated
ISIS leader ‘killed’ in US airstrikes,1631,unrelated
Batman Set To Play Steve Jobs In Upcoming Biopic,1658,unrelated
Eyewitness Says Viral Video of Homeless Man Was Staged,626,unrelated
Seth Rogen may play Steve Wozniak alongside Christian Bale as Steve Jobs,616,unrelated
Bug in iOS 8's 'Reset All Settings' Option Also Erases iCloud Drive Documents,2061,unrelated
ISIS militants appear to behead abducted American journalist James Wright Foley in graphic video,2115,unrelated
Conflicting reports on alleged IS capture of Canadian woman,2445,unrelated
New Audio Reveals Pause in Gunfire When Michael Brown Was Shot: Attorney,958,unrelated
EBay appears to be planning an Apple Watch app,1397,discuss
#ISIS beheads photojournalist James Wright Foley in a massage to US to end its intervention in #Iraq.,446,discuss
Rajasthan: Angry mob teaches rapist a lesson; chops penis off,2196,unrelated
US Lawmaker: Ten ISIS Fighters Have Been Apprehended Coming Across Southern Border (Video),625,unrelated
Kimye’s Fault? Anna Wintour’s NYC ‘Vogue’ Offices Hit With Disgusting Rat Infestation: ‘Rat Droppings On Desks’,2020,unrelated
A New iOS 8 Bug Can Delete All Of Your iCloud Documents,2330,unrelated
You all had an abortion! [Google Translate],2230,unrelated
Report: Former Baseball Star Jose Canseco Accidentally Shot At Home,459,unrelated
Missing American journalist reportedly beheaded by Islamic State ,1251,unrelated
"No, a spider (probably) didn't crawl through a man's body for several days",1848,unrelated
Founding Fathers-Era Time Capsule Found in Boston,1442,unrelated
Christian Bale won't play Steve Jobs,630,unrelated
That ESPN Domestic Violence Panel You Keep Hearing About Isn't Real,2531,unrelated
Isis claims to behead US journalist,1744,discuss
"Six months after abducting Nigerian schoolgirls, Boko Haram reportedly wants to free them",1540,discuss
Seth Rogen to play Steve Wozniak alongside Christian Bale's Steve Jobs,1588,unrelated
EXCLUSIVE: New York Mag’s Boy Genius Investor Made It All Up,405,unrelated
"Obama, Outraged Over Beheading, Vows to Stay on Course",2526,unrelated
Macaulay Culkin: Death claims about former child star revealed to be yet another hoax,1423,unrelated
Michael Phelps’ ‘girlfriend’ reveals she was born a man – and never told the swimmer,1847,agree
Man has his PENIS cut off by angry mob after 'attempted rape' of teenager,1808,unrelated
Brian Williams slams social media for speculation weatherman Mike Seidel relieved himself on air,1169,unrelated
Identity of ISIS terrorist known as 'Jihadi John' reportedly revealed,2033,unrelated
Apple Watch to reportedly offer 'Power Reserve' to help extend battery life,241,discuss
Seth Rogen Eyed to Play Apple's Steve Wozniak in Christian Bale's Steve Jobs Movie (Exclusive),626,unrelated
Strange mark turns out to be tropical spider burrowing under vacationer's skin,2406,unrelated
