Headline,Body ID,Stance
"Apple Watch pricing: Will you spend $5000 for Gold edition, $500 for stainless steel?",1240,unrelated
That Boko Haram Ceasefire in Nigeria Isn’t A Ceasefire,1540,agree
Video shows ISIL beheading of photojournalist James Foley,2450,agree
Has Kim's SISTER taken over North Korea? Dictator fails to show for key Communist event (but does send a nice flower basket instead),986,unrelated
Frisco: Sick patient claims to have had contact with Ebola victim,1582,unrelated
Weaponized Ebola? ISIS Militants Said To Contract Deadly Virus,2138,discuss
"Reports Isis fighters have contracted Ebola are 'incorrect', says Iraqi health ministry",1004,unrelated
SEND IN THE DRONES: Predator drones flown over IS headquarters in Syria,1234,unrelated
"Despite no Ebola case in Kansas City, the rumor goes viral",2501,agree
ISIS Militants Allegedly Contracted Ebola,1385,unrelated
Audio recording of Michael Brown being gunned down WAS made at the time he was killed: App company appears to confirm tape of ELEVEN bullets being fired - including final volley of 'kill shots',346,unrelated
"Islamic State, in video titled ""A Message to America,"" beheads American journalist James Wright Foley who was kidnapped in 2012",938,unrelated
Another American hostage at risk by Islamic state,1295,unrelated
Iraqi and Kurdish media reports cases of Ebola among Islamic State fighters in Mosul,1904,discuss
"Mass Graves Found In Mexico, Near Place Where 43 Students Went Missing",1156,discuss
"At CBS Detroit, Fan Site 'Scuttlebutt' Is Enough to Publish Batmobile Rumor",734,unrelated
"Soon Marijuana May Lead to Ticket, Not Arrest, in New York",227,unrelated
"It was me! Student, 19, reveals SHE was the Teletubbies' giggling baby in the sky - and was paid just £250 and a box of toys",2227,agree
Luke Somers' sister says he was killed in failed Yemen rescue attempt,2318,discuss
"Teen Made $72 Million Trading Stocks, Confirms Teen Dominance Worldwide",2367,unrelated
Man discovers spider living under his skin during Bali vacation,181,unrelated
Wayward sister ‘nun the wiser’ about baby,1760,unrelated
Kim Jong-Un 'bans the name Kim Jong-un',11,unrelated
"Michael Zehaf-Bibeau, slain Ottawa shooter, had criminal record in Quebec, B.C.",2246,agree
Fears Islamic State could launch EBOLA attack on Britain after fighters 'contract virus',639,discuss
Missing Libyan aircraft spark fears of 9/11-style attack in North Africa,1083,unrelated
"Teen Made $72 Million Trading Stocks, Confirms Teen Dominance Worldwide",1987,discuss
"Wife, child of Islamic State head Abu Bakr al-Baghdadi held in Lebanon, officials say",1913,unrelated
Luke Somers: British-born photojournalist 'killed by al-Qaeda after failed rescue attempt in Yemen',2375,unrelated
British hostage David Haines beheaded by Islamic State terrorists,1011,discuss
ISIS Video: America’s Air Dropped Weapons Now in Our Hands,2295,discuss
More American Weapons for ISIS,104,unrelated
Indian civil servant sacked 'after 24-year sickie',2134,agree
WTC rats scare off Anna Wintour,754,unrelated
US hostage Luke Somers dies after rescue bid,2318,discuss
"'American bombing had signed my death certificate': Missing US journalist James Wright Foley goes unflinching to his death as ISIS behead him in horrific video, as a warning to Obama",1905,unrelated
Boko Haram 'ceasefire' doubts after attacks reported in Nigeria,2520,unrelated
Say 'eh-oh!' to the Teletubbies SUN BABY - can you still recognise her after 19 years?,504,unrelated
Marijuana Law New York: How No-Arrest Policy Could Make Things Worse For Minor Offenders ,1383,unrelated
Christian Bale quits Steve Jobs movie,1299,agree
ISIS Claims To Have Captured US Airdrop Weapons,168,unrelated
A soldier has been shot at Canada’s war memorial just steps away from the nation’s parliament,1988,unrelated
Audio of gunfire in Michael Brown case authenticated by app company,2252,unrelated
Audio of gunfire in Michael Brown case authenticated by app company,724,unrelated
Islamic State claims it executed American photojournalist James Foley,984,unrelated
"Comcast Is Threatening To Cut Off Customers Who Use Tor, The Web Browser For Criminals",503,unrelated
"Nigeria claims deal with Boko Haram on ceasefire, kidnapped girls",903,unrelated
ISIS cracks down on five confirmed Ebola cases among fighters: official,267,unrelated
Emotional sergeant-at-arms is greeted back to parliament with a rousing standing ovation a day after he heroically shot dead terrorist - the first time he used weapon in 30 year career,1786,unrelated
ISIL allegedly kills US journalist in video,2524,discuss
"IS Beheads Briton David Cawthorne Haines, Threatens to Execute Another Briton, Alan Henning",1011,unrelated
British hostage David Haines beheaded by Islamic State terrorists,787,unrelated
Christian Bale in Talks to Play Steve Jobs in Danny Boyle's Biopic,1854,unrelated
Dog abandoned at railway station with suitcase set for happy ending as offers pour in,2176,unrelated
Steve Jobs Biopic Eyes Seth Rogen to Play Apple Co-Founder Steve Wozniak,761,unrelated
Christian Bale Won't Play Steve Jobs After All,1234,unrelated
WAS NBC METEOROLOGIST MIKE SEIDEL PEEING IN THE SNOW ON CAMERA? A TESTY BRIAN WILLIAMS EXPLAINS,381,unrelated
Mystery man slaps shoppers around head for sneezing,195,unrelated
The Internet Tried To Make Axl Rose Its Latest Death Hoax Victim,2343,unrelated
Is the Alleged Audio of the Gunshots That Killed Michael Brown a Hoax?,2235,agree
Michael Phelps’ alleged girlfriend says she was born intersex,570,unrelated
The Apple Watch has a low-power mode that only tells the time,1197,unrelated
Ebola Outbreak 2015 Update: ISIS Fighters May Have Contracted Deadly Virus,1921,unrelated
Christian Bale won't play Steve Jobs,860,discuss
Israeli Canadian fighting ISIS posts on Facebook: I'm safe and secure,1224,unrelated
"Obama, Outraged Over Beheading, Vows to Stay on Course",11,unrelated
"ISIS beheads American photo-journalist James Wright Foley, threatens more to come",704,unrelated
"Fidel Castro Rumors Sweep Internet, but No Sign in Cuba",2039,unrelated
Tropical spider burrows under man's skin through scar,1883,agree
Macaulay Culkin dead hoax: Fake death report spreads on social networks,2523,unrelated
Brian Williams slams social media for speculation weatherman Mike Seidel relieved himself on air,54,unrelated
"Christian Bale in talks to play Steve Jobs for Sony, Danny Boyle",1854,unrelated
Nujaifi Condemns / Daash / crime in Saqlawiyah and Alsiger areas of Anbar.,2024,unrelated
Two GOP Congressmen Say Suspected Terrorists Caught Crossing U.S.–Mexico Border,167,unrelated
Predator drones being flown over Isil's Syrian 'capital',919,agree
"Google to buy big chunk of Pacific Shores, iconic Redwood City office park",1549,unrelated
Blundering boyfriend burns down college after trying to impress his girlfriend with elaborate marriage proposal,669,discuss
Michael Zehaf-Bibeau was shot nearly a dozen times before Kevin Vickers fatally wounded him,2521,unrelated
Zack Snyder Makes Fun of Stolen Batmobile Rumor with New Image,2090,unrelated
Kim Jong-un relying on ‘cobra wine’ after problems with trouser snake,1212,unrelated
Pumpkin Spice Condoms Could Be The Only Thing To Save The World From Basic Children,1954,discuss
Man has his PENIS cut off by angry mob after 'attempted rape' of teenager,1673,agree
New policy could reduce marijuana possession arrests,1192,unrelated
Moment U.S. Marine is saved by his Kevlar helmet as Taliban sniper bullet hits him in head,1724,unrelated
This Letter To Parents From A 1970s Lego Set Contains An Important Message For Gender Equality,1969,discuss
"Boko Haram Cease-Fire: Abducted Nigerian Schoolgirls To Be Released, Officials Say",34,unrelated
Audio of gunfire in Michael Brown case authenticated by app company,2187,unrelated
CNN Posts Alleged Audio of Michael Brown Shooting,1832,unrelated
British aid worker David Haines beheaded by ISIL,68,unrelated
Saudi fatwa banning snowmen triggers heated debate,2114,unrelated
Pumpkin Spice Condoms Could Be The Only Thing To Save The World From Basic Children,2240,unrelated
Ottawa gunman identified as 32-year-old Michael Zehaf-Bibeau,2302,unrelated
More American Weapons for ISIS,1010,discuss
Audio recording allegedly captures moment Michael Brown was shot,456,unrelated
"Macaulay Culkin NOT Dead: Facebook, Twitter Death Hoax Goes Viral",1686,unrelated
"Zack Snyder Kills ""Stolen Batmobile"" Rumor With Great Photo",1311,unrelated
"No, a spider (probably) didn't crawl through a man's body for several days",1579,discuss
"Nigeria's missing girls 'to be released by Boko Haram', government aide claims",1374,unrelated
BREAKING: ISIS Beheads American Journalist James Wright Foley,1295,unrelated
CNN Posts Alleged Audio of Michael Brown Shooting,1438,unrelated
"Apple Watch Battery Life Currently 'About a Day', but May Improve for 2015 Launch",2002,unrelated
U.S. airstrike kills Islamic Al Shabab terrorist leader in Somalia,1024,unrelated
Insurgents killed in Nigeria despite alleged truce with Boko Haram,1661,unrelated
US Lawmaker: Ten ISIS Fighters Have Been Apprehended Coming Across Southern Border (Video),239,unrelated
This College Student Claims She Was The 'Teletubbies' Sun Baby,1834,unrelated
Report: Exec popped for $300k dinner after run at blackjack,2463,unrelated
'Spiderman' squished: Experts debunk claims,220,unrelated
Insurgents killed in Nigeria despite alleged truce with Boko Haram,821,unrelated
Jordan king cites Clint Eastwood in revenge vow,205,unrelated
Alleged audio of Michael Brown shooting has surfaced,1034,unrelated
Tourist wakes to find strange red trail on his stomach - and discovers a spider has burrowed through his appendix scar and crawled UNDER his skin while on holiday in Bali,1422,unrelated
Report: British intelligence has identified Foley's killer,1240,unrelated
Is the iPhone 6 Really Pulling Out Your Hair?,431,unrelated
"BREAKING NEWS: Female American aid worker, 26, held hostage by ISIS for 18 months has been 'killed in Jordanian air strike'",493,unrelated
Armed U.S. drones spotted flying over Syria in possible hunt for ISIS leader,1400,unrelated
"Mass Graves Found In Mexico, Near Place Where 43 Students Went Missing",712,unrelated
KIM JONG-UN NECKS SNAKE WINE FOR VIRILITY,1827,discuss
Isis video claims to show beheading of British hostage David Haines,787,unrelated
BREAKING UDPATED: ISIS REPORTEDLY USE CHEMICAL WEAPONS IN KOBANE,788,unrelated
"So, There Might Be a Rat Infestation at Vogue",132,discuss
Hope Fades for Girls' Release After Boko Haram 'Truce' Breached,1761,discuss
"North Korean leader Kim Jong Un had ankle surgery, report says",1103,unrelated
You all had an abortion! [Google Translate],208,unrelated
Media Fooled Again? Story Claims 7 of 28 Girls On School Trip Came Home Pregnant,1408,unrelated
SEND IN THE DRONES: Predator drones flown over IS headquarters in Syria,2412,discuss
Missing Libyan aircraft spark fears of 9/11-style attack in North Africa,2309,unrelated
"Op-Ed: Hoax – Priest who never existed claims he died, saw female God",2115,unrelated
Setting the record straight on tor,720,unrelated
'Hairgate': iPhone hit by new social media storm,614,unrelated
"No, A Spider Did Not Burrow Under A Man's Skin And Live There For Days",1500,unrelated
"McDonald’s to Stop Serving Overweight Customers in January? Nope, ‘1/15/2015′ Story is Fake",2302,unrelated
Christian Bale in Talks to Play Steve Jobs (Exclusive),687,unrelated
"One gunman killed in shooting on Parliament Hill in Ottawa, hunt on for other shooters",1253,unrelated
Boko Haram ceasefire ignored as violence flares in Borno state,800,unrelated
"Jihadi John named as Mohammed Emwazi, from west London",299,unrelated
"Video showing American journalist beheaded believed real, officials and family say",1873,unrelated
Missing Libyan jetliners raise fears of terror attacks on 9/11,8,unrelated
"Oh Hey, Paul Rudd Was One Of The Dallas Airport Homophobe Heroes, No Big",1000,unrelated
Obama administration DENIES congressman's claim that 'at least ten ISIS fighters have been caught coming across the Mexican border in Texas',2266,discuss
"UK spies identify Foley’s killer, Abdel-Majed Abdel Bary a key suspect",1478,unrelated
ISIS Militants Allegedly Contracted Ebola,950,unrelated
Seth Rogen Is Woz,89,unrelated
Sugarhill Gang's Big Bank Hank Dead At 57,1831,agree
Video Purports to Show Beheading of American Journalist,826,unrelated
An Audio Recording of the Michael Brown Shooting Has Reportedly Surfaced,900,unrelated
"Fidel Castro Dead? Yes, He Is… But The Cuban Leader Is Alive, Death Rumors Proven False",1832,unrelated
Macaulay Culkin Dead: Internet Death Hoax Claims Actor Found Dead In Apartment,2502,agree
"Video Appears to Show Beheading of Journalist James Foley, Who Went Missing in Syria",2067,discuss
"US, UK eye rapper as British-born militant who beheaded journalist James Foley",2327,discuss
Mexico Says Students Not Among Dead in Mass Grave,2342,discuss
"ISIS Claims Female American Hostage, Kayla Mueller, Killed in Airstrike",2387,discuss
Audio recording of Michael Brown being gunned down WAS made at the time he was killed: App company appears to confirm tape of ELEVEN bullets being fired - including final volley of 'kill shots',1921,unrelated
"BREAKING NEWS: Female American aid worker, 26, held hostage by ISIS for 18 months has been 'killed in Jordanian air strike'",532,unrelated
"Evander Kane ""On Way Out"" From Source, Price Is Very High; Who Is In?",1385,unrelated
Nicaraguan commission on possible meteorite crash presents rock samples,724,unrelated
Judd Nelson rebuffs Internet rumors that he died of a drug overdose.,524,unrelated
ISIL Beheads American Photojournalist in Iraq,2495,discuss
Mexican investigators fear mass grave might hold 43 missing students,1678,unrelated
Govt fires employee who skipped work for 24 years,686,unrelated
PGA Spokesman and Tiger Woods' Agent Deny Drug Suspension Allegations,2280,unrelated
The Chinese Guide to Avoiding a Bad English Name,723,unrelated
Former PGA Tour player: Tiger Woods suspended for drug test failure,498,unrelated
Russian Man Wakes Up to Find His Testicles Have Been Stolen,1258,unrelated
Lynch mob chop man's penis off after catching him allegedly trying to rape teenager,2415,unrelated
Nationwide turkey recall? Ebola-infected birds? USDA debunks the hoax,754,unrelated
ISIS Video Claims to Show Beheading of British Hostage,331,unrelated
Isis leader Abu Bakr al-Baghdadi's 'wife and son detained in Lebanon',1875,unrelated
‘Photo of slain IS leader’ reported to be doctored,1466,discuss
REPORT: JETLINERS STOLEN FROM LIBYA COULD BE USED TO ATTACK U.S. ON 9/11,887,unrelated
The Image That Everyone Is Sharing By 'Banksy' Isn't By Banksy — But It's Awesome,1177,unrelated
British aid worker David Haines beheaded by ISIL,2034,unrelated
SEND IN THE DRONES: Predator drones flown over IS headquarters in Syria,1296,unrelated
Saudi Arabia 'fatwa over building of snowmen',972,unrelated
Hunt for 'cruel' owner who abandoned dog at train station,498,unrelated
Audio may have captured Michael Brown shooting,1289,unrelated
Taylor Lianne Chandler: Michael Phelps' Cougar Girlfriend Revealed?,712,unrelated
Islamic State releases video apparently showing the beheading of missing US journalist James Foley,1679,discuss
"ISIS beheads American photo-journalist James Wright Foley, threatens more to come",1627,unrelated
SHOCKING: Indian Man's Penis Cut-off After He Was Caught Attempting Rape [Photos],2072,unrelated
North Dakota Names Landfill After Obama,1170,agree
Angry mob chops off man's genitals with butcher’s knife for alleged rape attempt,1022,agree
Is this the world's oldest burger? Man claims to have kept McDonald's Quarter Pounder for 20 YEARS,1806,unrelated
Matt Taibbi takes a leave of absence from First Look Media,1438,unrelated
Small Meteorite Hits Managua,524,unrelated
REPORT: JETLINERS STOLEN FROM LIBYA COULD BE USED TO ATTACK U.S. ON 9/11,1699,unrelated
Canadian-Israeli Woman May Have Been Captured In Syria: Reports,1106,discuss
"Apple Media Event Rumored for Late February, Apple Watch and 12"" MacBook Air Likely Topics [Updated]",346,unrelated
A Bunch Of Folks Are Passing Around This Hoax Video Of A Bird Pooping On Vladimir Putin,1155,unrelated
Apple Watch won’t be the digital doctor it could have been,607,unrelated
BREAKING NEWS: Gunman 'shot dead' after wounding soldier near Canada parliament,2156,discuss
Man Known as ‘Jihadi John’ Is Identified as Mohammed Emwazi,1906,unrelated
Samsung is reportedly making a secret new chip in the Apple Watch,1234,unrelated
Islamic State militants claim to behead missing American journalist,1040,unrelated
Al-Shabab leader who ordered Kenya mall massacre believed killed in US drone attack in Somalia,81,unrelated
Seth Rogen to Play Apple’s Steve Wozniak,1707,unrelated
Report: Nearly a Dozen Commercial Airliners Missing Ahead of 9/11 Anniversary After Islamists Overrun Libyan Airport,1865,discuss
"Boko Haram leader denies ceasefire deal, says 200 abducted girls married off ",2139,discuss
"Rare meteorite impact causes blast in Nicaragua's capital, Managua",1825,discuss
Hospital: Man not being treated for Ebola in Kansas City,2410,unrelated
Ottawa Gunman Identified As Michael Zehaf-Bibeau,1866,discuss
"Don't forget to tip...especially if you spend $300,000",2463,unrelated
Isis militants claim to have killed US journalist James Foley,676,unrelated
Islamic State Leader al-Baghdadi “Not Dead”,936,unrelated
Nasa questions whether crater in Nicaragua caused by meteorite,767,agree
Web of confusion as scientists cast doubt on man's claims that a spider burrowed into his stomach through his SCAR,2175,unrelated
Soldier shot near Canadian parliament building,1786,unrelated
Watch marine take sniper shot to the head and live,986,unrelated
6 Islamist militants killed in US attack in Somalia,139,unrelated
11 aircraft are missing from ‘terrorist-held’ Tripoli airport ahead of 9/11 anniversary,1574,unrelated
Man chops off his penis after his girlfriend breaks up with him,1560,discuss
The Pumpkin-Spice Condom Is Just a Figment of Your Own Gross Imagination,2269,agree
Christian Bale to play Steve Jobs in upcoming biopic,1939,unrelated
Abdel-Majed Abdel Bary in Foley beheading: London rapper songs help identify him,2295,unrelated
Christian Bale to play Steve Jobs in upcoming biopic,2211,disagree
"Sorry, Everyone: Durex Is Unfortunately Not Making Pumpkin Spice Condoms",2269,agree
HORROR: ISIS Fighters Have Reportedly Contracted Ebola,2299,unrelated
CARLISLE HEAD SLAPPER ATTACKS SNEEZING WOMEN,1155,agree
Isis leader Abu Bakr al-Baghdadi's 'wife and son detained in Lebanon',72,unrelated
Priest who died for 48 minutes says he met God and she’s a woman,1574,unrelated
"ISIS Militants Have Contracted Ebola: Iraqi, Kurdish Media Reports",2175,unrelated
“Axl Rose dead 2014” : Guns N' Roses frontman killed by internet death hoax,2525,agree
ISIS Kobani Update: Possible ISIS Chemical Attack On Kurdish Civilians In Kobani,428,unrelated
CNN Plays Alleged Audiotape of Michael Brown ShootingMilitarization Of Police,1299,unrelated
'There is no limit to their depravity' Islamic State FEED mother her own SON,1120,unrelated
CNN audio: Is this the moment Michael Brown was shot?,2220,discuss
This Week In Weird News: Horrible Human Slaps Elderly Woman For Sneezing,1854,unrelated
Islamic State militants claim to behead missing American journalist,7,unrelated
BREAKING: Soldier shot at War Memorial in Ottawa,2252,unrelated
More than 200 kidnapped Nigerian girls to be released after deal reached with Boko Haram,402,unrelated
Unconfirmed reports claim Canadian-Israeli Gill Rosenberg captured by ISIS,1240,unrelated
Questions raised over Nicaragua 'meteorite',731,unrelated
Brian Williams Demands Apology From Social Media Over Erroneous Urination Reports (Video),54,unrelated
CNN Plays Alleged Audiotape of Michael Brown ShootingMilitarization Of Police,1916,discuss
'Spiderman' squished: Experts debunk claims,2009,unrelated
Tropical spider burrowed under Bali tourist's skin,1549,unrelated
"Apple Watch Stainless Steel variant reportedly priced at $500, $4,000 for the gold variant",1660,unrelated
Ebola Outbreak 2015 Update: ISIS Fighters May Have Contracted Deadly Virus,1438,unrelated
Macaulay Culkin Hasn’t Died Despite What Everyone Is Saying On Facebook,984,unrelated
Detroit Police Issue Statement That The Batmobile Is Safe,1338,unrelated
ISIS Blasts 'Scorpion Bombs' At Civilian Areas In Iraq; Mosul Residents Living In Fear,844,unrelated
GCPD Solved Stolen Batmobile Case?,942,discuss
Isis tells mother on rescue mission :’You’ve just eaten your son’,1956,discuss
Michael Phelps' girlfriend was born male but did not tell swimmer about her past,35,unrelated
Angry mob hacks off alleged rapist's genitals with meat cleaver after dragging him into butchers,2106,unrelated
GRAPHIC CONTENT: Girl sneers at man's tiny penis so he CHOPS IT OFF and bins it,413,unrelated
Unconfirmed Reports Say UK Hostage Held By ISIS Found Innocent,1263,unrelated
Nigeria says it has deal with Boko Haram to release kidnapped girls,1761,discuss
"11 Tripoli Planes Still Missing, Sparks 9/11 Concerns",2309,unrelated
"Vice Media Chief Said to Pay $300,000 for Dinner for 30",1125,unrelated
Michael Brown shooting audio caught on tape?,186,discuss
"Vice's Shane Smith drops $300,000 on Vegas dinner",690,unrelated
"And finally: Apple Watch to launch 9 March with 100,000 apps",1975,unrelated
ISIS cracks down on five confirmed Ebola cases among fighters: official,225,unrelated
Rumors of ISIS leader's death debunked,414,unrelated
"Gene Munster Predicts $499 Steel Apple Watch, $4,999 for 18k Gold Edition",2223,discuss
Isis claims to behead US journalist,1905,unrelated
Angry mob cut off rapist’s penis with meat cleaver (VIEWER DISCRETION),1673,agree
Podcast: Brown Moses on what’s flying over Iraq and Syria,1170,unrelated
Apple-HBO Deal Seen Launching Web-only Apple TV Streaming Service For $15 Per Month,1074,discuss
"Apple Reportedly Preparing 12-inch MacBook Air, Thinner and Lighter than Existing Models",727,unrelated
Big Bank Hank of The Sugarhill Gang is dead at 57,2080,agree
Texas Plumber Has ‘No Idea’ How Company Truck Ended Up With ISIS,2379,agree
Man chops off his own penis after girlfriend told him he was no good in bed,812,unrelated
Robert Plant Literally Ripped Up An $800 Million Contract To Reunite Led Zeppelin,158,unrelated
iPhone Game Developer Quits Job By Hiding The Greatest Letter Of Resignation Ever Inside His Game,93,unrelated
ISIL video claims beheading of kidnapped journalist James Foley,2453,unrelated
CBI registers 'criminal conspiracy' case against Dera chief after claims 400 male followers were forcibly castrated,1222,unrelated
Italian fisherman catches monstrous 280-pound catfish,842,agree
"FIDEL CASTRO DEATH WATCH: RUMORS HEAT UP, CUBA DENIES",2506,discuss
Rapper Big Bank Hank of Sugarhill Gang dies at 57,2398,agree
Robot security guards now patrolling Microsoft's Silicon Valley campus,438,unrelated
"Fidel Castro Rumors Sweep Internet, But No Sign in Cuba",2463,unrelated
Zack Snyder Responds to Fake Stolen Batmobile Report,2055,unrelated
"Pizza delivery man gets tipped more than $2,000 for a single delivery",542,unrelated
"Despite no Ebola case in Kansas City, the rumor goes viral",707,unrelated
Police hunting mystery 'slapper' in tweed jacket who attacks people who sneeze in town's high street,2114,unrelated
WHO investigates media reports ISIS fighters contracted Ebola,2299,unrelated
Is Kim Jong-un Opening North Korean Restaurant in Scotland?,1143,unrelated
Michael Abdul Zehaf Bibeau Pictures: Photos of Alleged ISIS-Linked Gunman in Canada,1970,discuss
DHS: GOP Rep.’s Claim ISIS Members Caught at U.S. Border ‘Categorically False’,2042,unrelated
ESPN to save NFL's image with all-male domestic abuse discussion,1148,unrelated
#ISIS beheads photojournalist James Wright Foley in a massage to US to end its intervention in #Iraq.,1574,unrelated
Report: Audio Reveals Pause Between Gunshots When Michael Brown Was Shot,2354,unrelated
The Guy Who Said a Spider Burrowed Under His Skin? Experts Say…,1883,discuss
American hostage killed in rescue attempt in Yemen - senior official,1429,unrelated
"US hostage 'murdered' by militants in Yemen, says Hagel",2015,unrelated
DNA tests prove Lebanon IS holding ISIS chief al-Baghdadi's ex-wife and daughter after they were caught with fake passports,527,unrelated
Macaulay Culkin dead: The death hoax is once again on the child actor,2175,unrelated
"Comcast Is Threatening To Cut Off Customers Who Use Tor, The Web Browser For Criminals",2252,unrelated
Israeli-Canadian Woman 'Captured' By ISIS Says She Is 'Safe And Secure',1223,unrelated
Islamic State claims to have beheaded American journalist,139,unrelated
We took a look at the photo said to show the body of Islamic State leader Abu Bakr Al-Baghdadi (right) and found it was really an ethnic Albanian militant killed in 2013,1222,unrelated
"HBO streaming service could launch in April for $15 per month, work on Apple TV",1923,unrelated
PGA Tour Denies Claim That Tiger Woods Failed A Drug Test,205,unrelated
Tropical spider 'burrowed under man's skin through scar' - video report,1271,unrelated
New iOS 8 bug can delete all of your iCloud documents,115,unrelated
Report: Apple Watch to Ship in March,414,discuss
"Rumor: Gold Apple Watch Edition priced up to $5,000, steel version at $500, will debut on Feb. 14",10,unrelated
IRAQI HEALTH OFFICIAL: EBOLA HAS KILLED 5 ISIS FIGHTERS,568,unrelated
"No, a spider (probably) didn't crawl through a man's body for several days",1797,agree
Psychoactive magic mushroom found in grounds of Buckingham Palace,2478,agree
Nationwide turkey recall? Ebola-infected birds? USDA debunks the hoax,1459,unrelated
HORROR: ISIS Fighters Have Reportedly Contracted Ebola,2025,discuss
Nigeria says ceasefire agreed with Boko Haram,1697,unrelated
