Headline,Body ID,Stance
"Rumor: Stainless Steel Apple Watch Will Cost $500, Gold $4,000",698,unrelated
Nun Gives Birth To Baby Boy After Suffering Intense Stomach Pains,1120,unrelated
"Boko Haram claims to have German hostage, denies ceasefire",1019,unrelated
James Foley remembered as 'brave and tireless' journalist,1580,agree
The Force Awakens News: Director J.J. Abrams Eyes Summer Release for Star Wars 7 Because of Too Many Spoilers,1562,unrelated
"Boko Haram claims to have German hostage, denies ceasefire",2520,unrelated
Kim Yo-jong in Charge: Kim Jong-un's Sister 'Replaces' North Korean Dictator During Illness,2344,discuss
"Apple's New MacBook Will Be A Thinner, Cleaner, Faster 12-Inch MacBook Air",727,unrelated
"Teen Made $72 Million Trading Stocks, Confirms Teen Dominance Worldwide",1781,discuss
BREAKING: British-born hostage 'KILLED in failed rescue attempt',826,discuss
Somalia Shebab chief Ahmed Abdi Godane likely dead in US strike: Source,832,unrelated
Texas plumber's truck on front line of Syria war,1661,unrelated
"Reports Isis fighters have contracted Ebola are 'incorrect', says Iraqi health ministry",2078,unrelated
Russian TV actor wakes up to find his testicles stolen,1943,unrelated
Saudi cleric condemns snowmen as anti-Islamic,1090,unrelated
Terrorism fears rise amid reports of stolen jetliners,1588,unrelated
Ebola Outbreak 2015 Update: ISIS Fighters May Have Contracted Deadly Virus,938,discuss
Boko Haram 'ceasefire' doubts after attacks reported in Nigeria,2045,unrelated
Islamic Militants Post Video Claiming to Show Beheading of U.S. Journalist,1658,discuss
"Former Porn Star Behind YouTube Sensation ‘DC Toy Collector,’ Makes $5 Million Per Year Unboxing Disney Toys",381,unrelated
Video Messaging App Says Audio Recording Of Michael Brown's Shooting Is Authentic,1921,unrelated
The Internet Tried To Make Axl Rose Its Latest Death Hoax Victim,769,unrelated
‘Feminist’ says she aborted baby because it was a boy,2161,unrelated
Islamic Militants Post Video Claiming to Show Beheading of U.S. Journalist,456,discuss
Tropical spider burrowed under man's skin through appendix scar and lived there for THREE DAYS,761,agree
ISIS Getting Ebola,592,unrelated
Pure Evil: Islamic State Beheads American Journalist James Wright Foley,1347,unrelated
Video Purports to Show Beheading of American Journalist,1361,unrelated
Boko Haram ceasefire ignored as violence flares in Borno state,1630,disagree
"Tour, agent: Tiger Woods not banned",1175,unrelated
ISIS Getting Ebola,2197,unrelated
"No, Robert Plant Didn’t Rip Up an $800 Million Contract",699,agree
Report: Israeli-Canadian woman fighting Islamic State has been kidnapped by terror group,1240,unrelated
Boko Haram denies truce to release kidnapped schoolgirls,298,unrelated
"Six months after abducting Nigerian schoolgirls, Boko Haram reportedly wants to free them",2261,unrelated
Russian Man Wakes Up to Find His Testicles Have Been Stolen,2044,agree
Josh Paler Lin Gives A Homeless Man $100 And Follows Him To See How He Spends It,1922,discuss
Mohammed Emwazi: Man identified as Isis killer 'Jihadi John' was 'stopped by MI5' while on safari holiday in Africa in 2010,921,discuss
"Taibbi takes time out from First Look after “disagreements.” Can I publish our emails now, Matt?",1083,agree
Macaulay Culkin Dead: Actor Once Again Victim Of Death Hoax,2240,unrelated
"Why the Gold Apple Watch Edition Must Cost $10,000",2223,discuss
Schoolboy who got electric shock from lamppost claims he now has magnetic powers,1317,unrelated
BREAKING: ISIS USES CHEMICAL WEAPONS – Murders 300 Iraqi Soldiers in Chlorine Gas Attack,1136,discuss
Chinese advised to choose British-sounding names to get ahead,1170,unrelated
Islamic State releases video apparently showing the beheading of missing US journalist James Foley,1869,unrelated
Duped again: Macaulay Culkin is not dead,498,unrelated
"Apple Watch to Be Shower-Proof, Have 100,000 Apps at Launch: Reports",1988,unrelated
Parliament Hill shooting: Sergeant-At-Arms Kevin Vickers the family hero who took down Ottawa gunman,2307,unrelated
Catholic Priest Claims God Is Female After Clinically Dead Experience,478,unrelated
"Suspected meteorite leaves crater in Managua, is linked to asteroid",61,unrelated
"Catholic Priest Dead For 48 Minutes, Is Miraculously Revived – His Revelations About God Are Even More Shocking",1521,disagree
Eye-catching! Rare sighting of Anna Wintour without her trademark sunglasses as she leaves 'rat-infested' Vogue office,2263,agree
Bird defecates on Vladimir Putin during speech (video),2278,unrelated
Terrorism fears rise amid reports of stolen jetliners,2317,unrelated
Everyone chill! Banksy has NOT been arrested,1737,unrelated
"Is Apple about to launch a totally redesigned, 12-inch MacBook Air?",1545,unrelated
"No, That Wasn’t Paul Rudd Tackling an Airport Homophobe",1094,discuss
Anna Wintour: Is Rat Infestation At NYC ‘Vogue’ Office Kim Kardashian’s Fault?,754,unrelated
‘Wild Misinformation’: Brian Williams Explains the Mike Seidel Liveshot,2034,agree
DNA test confirms child is IS head Abu Bakr al-Baghdadi's daughter,691,unrelated
Hope Fades for Girls' Release After Boko Haram 'Truce' Breached,903,unrelated
Another American hostage at risk by Islamic state,2386,agree
Photo gallery: Amazing £300 operation by North Walsham vet on constipated goldfish,2078,unrelated
New Audio Allegedly Captures Moment Michael Brown Was Shot,1940,unrelated
Wife Of ISIS Leader Abu Bakr al-Baghdadi Detained In Lebanon,1883,unrelated
"Meteorite makes big crater in Nicaragua, government says",1817,unrelated
Report: NYPD to stop arresting people for minor marijuana offenses,2237,discuss
Armed U.S. drones spotted flying over Syria in possible hunt for ISIS leader,1509,discuss
Someone Spraypainted A Penis On A £1.5m Bugatti Veyron And It Went Very Viral,1435,unrelated
Guru who ordered 400 followers to be castrated 'so they could be closer to God' is investigated for grievous bodily harm in India,737,unrelated
Speeding Up ‘Seinfeld’ For Younger Viewers,2314,agree
Nigeria says ceasefire agreed with Boko Haram,34,unrelated
"Seven High School Girls Get Pregnant On Five-Day School Trip, Parents Outraged",1103,discuss
Is Durex Planning To Release A Pumpkin Spice Condom?,242,unrelated
"New York schoolboy who made $72MILLION trading stocks on his lunch breaks - and now takes his friends out to dine on $400 caviar, drives a BMW and has definitely made his immigrant parents proud",1760,discuss
Shots Heard In Alleged Brown Shooting Recording [AUDIO],167,unrelated
"Pope Francis did not tell boy heaven has room for pets, contrary to report",2473,unrelated
Senator: Detainees swapped for Bergdahl have contacted militants,320,unrelated
Kim Had Ankle Surgery:  Source,1848,unrelated
CNN Posts Alleged Audio of Michael Brown Shooting,2248,unrelated
#RIPFidel fuels false rumors of Cuban leader's death after another Fidel Castro dies,1010,unrelated
Nun Gives Birth To Baby Boy After Suffering Intense Stomach Pains,1786,unrelated
Jordan Vs ISIS: Reports Say King Abdullah II Could Personally Lead Airstrikes After Pilot’s Death,699,unrelated
Nigeria Says Boko Haram Cease-Fire May Lead to Release of Kidnapped Girls,1125,unrelated
BREAKING Gill Rosenberg former IDF soldier was captured by ISIS,1808,unrelated
"Kim Jong-un Broke Both Ankles and Is Hospitalized, Report Claims",2385,unrelated
Senior Western Intelligence Official Confirms London Rapper Abdel Majed Abdel Bary Is A Suspect In The Foley Killing,591,unrelated
Bugatti Veyron Vandalized With Penis Graffiti? Viral Photo Isn’t What It Seems,557,unrelated
Steve Jobs Biopic Eyes Seth Rogen to Play Apple Co-Founder Steve Wozniak,1538,unrelated
Kurds Deny Gill Rosenberg was in Kobane,1808,unrelated
More than 200 kidnapped Nigerian girls to be released after deal reached with Boko Haram,800,unrelated
Judd Nelson isn't dead; report is a hoax,1131,unrelated
"'Nasa Confirms Six Days of Darkness in December': No, they really don't - it's a hoax",804,unrelated
Video Purports To Show Beheading Of U.S. Journalist By Militants,1589,discuss
Bodies In Mexico Mass Grave Apparently Not Those Of Missing Students,1740,unrelated
Eye-catching! Rare sighting of Anna Wintour without her trademark sunglasses as she leaves 'rat-infested' Vogue office,17,unrelated
Abdel Majed Abdel Bary Emerges as Suspect in Foley Beheading,592,unrelated
"ISIS Claims It Kidnapped Gill Rosenberg, The First Western Woman To Fall Into The Group's Hands",2044,unrelated
SEE IT: California homeless man uses $100 gift to give food to others,1686,unrelated
Microsoft Hires Dalek-style Robocops to Guard Silicon Valley HQ,1074,unrelated
Christian Bale Is Steve Jobs,2343,discuss
Missing American journalist reportedly beheaded by Islamic State ,1116,discuss
6 Islamist militants killed in US attack in Somalia,1720,unrelated
Man who SLAPS people if they sneeze in public being hunted by police,2297,unrelated
Missing Mexican students 'not found in mass grave',761,unrelated
Christian Bale Won't Play Steve Jobs After All,755,agree
Canadian-Israeli Woman Says She Hasn’t Been Captured By ISIS,2265,unrelated
'Nasa Confirms Earth Will Experience 6 Days of Total Darkness in December' Fake News Story Goes Viral,154,agree
Senator: Detainees swapped for Bergdahl have contacted militants,2531,discuss
Iraq Denies Lebanon Captured Abu Bakr al-Baghdadi's Wife and Child,2360,unrelated
"Catholic Priest Dies for 48 Minutes, Comes Back to Life and Claims God Is Female",670,unrelated
"SMALL METEORITE STRIKES NICARAGUA, GOVERNMENT SAYS",2118,unrelated
Iraqi media: ISIS militants have contracted Ebola,2138,discuss
ISIS video showing beheading triggers international response,1011,unrelated
"Unconfirmed: ISIS Claims Kayla Mueller, American Female Hostage, Is Dead",532,unrelated
CNN Plays Alleged Recording of Michael Brown Shooting,1817,discuss
SHOCK CLAIM: PGA Golfer Says Tiger Woods Is Suspended For Failed Drug Test,431,discuss
Passenger Wears A Hazmat Suit To Dulles Airport [PHOTO],1178,unrelated
Iraqi Official Dismisses ‘Unfounded’ Reports That ISIS Fighters Have Ebola,2075,discuss
"Woman detained in Lebanon is not al-Baghdadi's wife, Iraq says",1883,unrelated
"Homeless man who became a YouTube sensation after spending $100 on food for his beggar friends gets a surprise Christmas meal, makeover and night in a hotel in new video... but is it all a hoax by a 'serial prankster'?",1922,discuss
Macaulay Culkin dead: The death hoax is once again on the child actor,2523,unrelated
Hope Fades for Girls' Release After Boko Haram 'Truce' Breached,2139,agree
Kim Jong-Un 'bans the name Kim Jong-un',2130,unrelated
New Audio Recording From Ferguson May Capture Michael Brown Shooting,1818,discuss
Iraqi media says ISIS militants have contracted Ebola,1385,unrelated
Audio may have captured Michael Brown shooting,2354,unrelated
US Lawmaker: Ten ISIS Fighters Have Been Apprehended Coming Across Southern Border (Video),1423,unrelated
"North Korean leader Kim Jong Un had ankle surgery, report says",932,unrelated
Video shows ISIL beheading of photojournalist James Foley,1658,agree
Claim: Comcast Got Complaining Customer Fired From His Job,2238,discuss
Vogue’s Rat Infestation: Disturbing New Details,1543,discuss
NET Extra: Back-from-the-dead Catholic priest claims God is a female,2296,unrelated
"10% of Consumers 'Very Likely' to Buy a Smartwatch in 2015, Suggesting 24M Apple Watches",1149,unrelated
"Confusion swirls, details murky in arrest of ISIS leader's 'wife'",1461,unrelated
"Tim Cook Reportedly Showers with Apple Watch, Suggesting It’s Waterproof",2330,unrelated
MPs credit sergeant-at-arms for saving lives in Parliament Hill shootings,342,unrelated
Eye-catching! Rare sighting of Anna Wintour without her trademark sunglasses as she leaves 'rat-infested' Vogue office,2498,agree
Congressman: ‘At least 10 ISIS fighters’ caught trying to cross into US,186,unrelated
North Korea reportedly bans anyone sharing Kim Jong Un's name,2032,discuss
Dylan Thomas Finds Tropical Spider Burrowed Under Skin,2096,unrelated
NASA Raises Doubts About Reports of Nicaraguan Meteorite,1622,discuss
Amazon.com to open first physical store in Manhattan: DJ,1802,unrelated
British-born rapper is main suspect in search for ISIS jihadist who beheaded James Foley,913,unrelated
Did Paul Rudd Help Tackle That Dallas Airport Gay-Basher?,1331,unrelated
"Op-Ed: Hoax – Priest who never existed claims he died, saw female God",1212,unrelated
Robot security guards now patrolling Microsoft's Silicon Valley campus,1863,unrelated
'Jihadi John': Isis fighter named as Mohammed Emwazi from west London,1427,unrelated
Report: Secret Service Lied About White House Fence Jumper,508,unrelated
Conde Nast's rat problem at One World Trade Centre: From red carpets to rodent droppings,367,unrelated
Shots Heard In Alleged Brown Shooting Recording [AUDIO],1009,discuss
Pentagon Denies It Killed ISIS Chief As Airstrikes Hit Top Extremists,1466,discuss
Report: A Radically Redesigned 12-Inch MacBook Air Is Coming,267,unrelated
Islamic State claims it executed American photojournalist James Foley,704,unrelated
REPORT: Alleged New Audio of Michael Brown Shooting,1900,unrelated
"ISIS Claims It Kidnapped Gill Rosenberg, The First Western Woman To Fall Into The Group's Hands",1197,unrelated
"Vice CEO Shane Smith reportedly spent $300,000 on a steak dinner at CES",1176,unrelated
Report: Possible audio tape of Michael Brown shooting,121,unrelated
Meteorite Leaves House-Sized Crater in Nicaragua’s Capital,1627,unrelated
James Foley beheading: London rapper turned jihadist believed to be under investigation for murder of journalist in Syria,951,discuss
'Spiderman' squished: Perth experts debunk spider burrowing claims,1500,unrelated
This Woman Exposed Her Cheating Boyfriend With A Brilliant Christmas Gift,2097,unrelated
Turkish Leader Says U.S. Airdrop Aided ISIS Militants,1239,unrelated
New Audio Allegedly Captures Moment Michael Brown Was Shot,132,unrelated
Video messaging service verifies timing of CNN audio recording,1818,agree
That Was Fast: Christian Bale Bails on Steve Jobs Biopic,591,agree
Islamic State militants claim to behead missing American journalist,826,unrelated
"Viral Video Of Homeless Man Spending $100 On Food For Other Homeless Was Faked, Witness Says",167,unrelated
Isis leader Abu Bakr al-Baghdadi's 'wife and son detained in Lebanon',2360,unrelated
Isis 'fed murdered kidnap victim to his own mother after she travelled to their headquarters and demanded to see him',1530,unrelated
WHO: Isis does not have Ebola – but contingency plan being developed for Iraq,267,unrelated
Seth Rogen reportedly nabs Steve Wozniak role in Steve Jobs filmSteve Jobs Iconic Moments,1539,unrelated
"Obama, Outraged Over Beheading, Vows to Stay on Course",524,unrelated
"Nigeria claims deal with Boko Haram on ceasefire, kidnapped girls",1761,discuss
Paul Rudd Is Not the Viral Video Hero Who Tackled a Gay Basher in Dallas,853,unrelated
Vladimir Putin’s Motorcade Looks Like A Massive Knob,1832,unrelated
"James Wright Foley, Kidnapped Journalist, Apparently Executed by ISIS",938,unrelated
Christian Bale to play Steve Jobs in upcoming biopic,2096,unrelated
"Islamic State, in video titled ""A Message to America,"" beheads American journalist James Wright Foley who was kidnapped in 2012",1747,agree
Shots Heard In Alleged Brown Shooting Recording [AUDIO],2002,unrelated
"In Kim Jong Un's absence, his sister may rule. Or not.",2313,discuss
Anna Wintour 'refuses to work at new World Trade Center Vogue office due to rat infestation',1045,discuss
Report claims Kim Jong-un underwent surgery to repair fractured ankles,1689,unrelated
Google Grows With $1.6 Billion in California Office Deals,2096,unrelated
"Six months after abducting Nigerian schoolgirls, Boko Haram reportedly wants to free them",1034,unrelated
Nicaragua Meteorite Impact Theory May Be Meteor-wrong,1744,unrelated
Saudi Arabian cleric issues fatwa against snowmen,2167,agree
"Hoax Alert: Father O’Neal, Who Has Met God and Thinks She’s a Woman, Is Made Up (Just Like God Herself)",2043,unrelated
"Sadly, Pumpkin Spice Condoms Aren't A Thing After All",1888,unrelated
Nun gives birth to surprise baby after complaining of stomach pains,391,unrelated
Big Bank Hank dead: Sugarhill Gang member and rapper dies aged 57,1996,unrelated
Axl Rose Found Dead of Sh*tty Hoax Website at Age 52,144,unrelated
Has Ebola infected Isis militants in Mosul?,1034,unrelated
[Updated] Saudi State Television Allegedly Blurs Michelle Obama’s Face During Meeting With New Saudi King,833,discuss
Isis video claims to show beheading of British hostage David Haines,1301,unrelated
'Jihadi John' identified: ISIS killer named as Mohammed Emwazi from West London,1427,unrelated
New York City Plans to End Arrests for Possession of Small Amounts of Marijuana,2372,discuss
ISIS Blasts 'Scorpion Bombs' At Civilian Areas In Iraq; Mosul Residents Living In Fear,2020,unrelated
"11 Tripoli Planes Still Missing, Sparks 9/11 Concerns",1660,unrelated
Nigeria says it has deal with Boko Haram to release kidnapped girls,1637,unrelated
'Jihadi John': Isis fighter named as Mohammed Emwazi from west London,1815,unrelated
Soldier shot near Canadian parliament building,892,unrelated
Boyfriend cuts off his penis and throws it in the bin after girlfriend dumps him for being bad in bed,81,unrelated
"Gill Rosenberg, former IDF soldier, possibly captured by ISIS while fighting with Kurds",1173,discuss
"Boko Haram denies truce, says kidnapped girls married",1921,unrelated
Pentagon: death of al Shabaab leader in U.S. strike would be major blow,932,unrelated
Street Artist BANKSY Arrested? Again?,667,unrelated
"Luke Somers, American Hostage, Is Killed During Rescue Attempt in Yemen, U.S. Official Says",271,unrelated
Report: Fence jumper made it into East Room of White House,508,unrelated
North Korea denies reports Kim Jong-un is to open state-backed restaurant in Scotland,1385,unrelated
Israeli Canadian fighting ISIS posts on Facebook: I'm safe and secure,2142,agree
"Jihadi John named as Mohammed Emwazi, from west London",1107,unrelated
"Gene Munster Predicts $499 Steel Apple Watch, $4,999 for 18k Gold Edition",1572,unrelated
Small Meteorite Strikes in Nicaragua's Capital City of Managua,2129,unrelated
"Video showing American journalist beheaded believed real, officials and family say",511,unrelated
Islamic State claims to have beheaded American journalist,2453,unrelated
This Is What The Sun Baby From ‘Teletubbies’ Looks Like Now,1623,agree
Media outlets identify 'Jihadi John',997,discuss
Nun who GAVE BIRTH to baby boy after suffering agonising stomach pains 'had no idea' she was pregnant,220,unrelated
MPs credit sergeant-at-arms for saving lives in Parliament Hill shootings,1885,unrelated
Spider Burrows Into Australian Man's Appendix Scar (VIDEO),1530,unrelated
A Letter Lego Sent to Parents in 1974 Holds an Important Message for the Parents of 2014,547,agree
Abdel Majed Abdel Bary Emerges as Suspect in Foley Beheading,477,unrelated
Lynch mob chop man's penis off after catching him allegedly trying to rape teenager,1981,agree
"At CBS Detroit, Fan Site 'Scuttlebutt' Is Enough to Publish Batmobile Rumor",1311,unrelated
Islamic State claims to have beheaded American journalist,1744,discuss
ISIS fighters 'have contracted Ebola': World Health Organisation investigating reports militants showed up at Iraqi hospital with lethal disease,900,unrelated
Mum Offers to Sell Twin Boy to Save Twin Girl,1627,agree
Conde Nast's rat problem at One World Trade Centre: From red carpets to rodent droppings,959,discuss
From bendgate to hairgate: Now iPhone 6 users complain the device is ripping out their hair,2303,unrelated
Ottawa shooting: Slain soldier named as Nathan Cirillo while suspect identified as Michael Zehaf-Bibeau,2002,unrelated
Tiger Woods Is Selling His Private Island For $7.1 Million,1375,agree
Was Alleged Audio of Michael Brown Shooting on CNN a Hoax?,2481,discuss
Is Ebola Virus Spreading Among ISIS Militants? Reports Claim Jihadists Seeking Cure at Mosul Hospital,2075,discuss
Christian Bale Pulls Out of Upcoming Steve Jobs Biopic,1406,unrelated
ISLAMIC STATE BEHEADS MISSING AMERICAN JOURNALIST JAMES WRIGHT FOLEY,984,unrelated
Islamic Militants Post Video Claiming to Show Beheading of U.S. Journalist,1385,unrelated
"ISIS Militants In Mosul Have Contracted Ebola, Iraqi Media Sources Claim",559,unrelated
Judicial Watch's Farrell: ISIS Terrorists Did Cross Mexican Border,220,unrelated
Small red book among finds in 113-year-old Boston time capsule,1471,unrelated
"NYPD to stop arresting for low-level marijuana charges, will issue tickets instead: source",2389,discuss
"No, Saudi TV Didn't Blur Out Michelle Obama's Face When the President Met King Salman",1343,unrelated
Female Israeli fighter said abducted by Islamic State  Read more: Female Israeli fighter said abducted by Islamic State,1319,unrelated
Texas plumber's truck spotted in Syria: 'We have nothing to do with terror at all',1921,unrelated
Report: Apple Watch Will Need Charging Every Day,1048,unrelated
"Apple Watch to Be Shower-Proof, Have 100,000 Apps at Launch: Reports",40,unrelated
"ISIS Claims It Kidnapped Gill Rosenberg, The First Western Woman To Fall Into The Group's Hands",2142,discuss
Bunbury local discovered a spider had burrowed under his skin on Bali holiday,724,unrelated
Nigeria says ceasefire agreed with Boko Haram,1896,discuss
Islamic State using 'SCORPION bombs' to terrorise victims,2127,unrelated
Apple may launch 12-inch MacBook Air with Retina Display,1097,unrelated
North Korea reportedly bans anyone sharing Kim Jong Un's name,1648,discuss
Missing Libyan jetliners raise fears of terror attacks on 9/11,1343,unrelated
"Jess Smith, 19, Claims She Was Teletubbies' Giggling Baby: What Did She Get Paid?",1212,unrelated
New iOS 8 bug can delete all of your iCloud documents,1224,unrelated
HBO in talks with Apple to be launch partner for coming web service 'HBO Now',551,unrelated
Michael Zehaf-Bibeau was shot nearly a dozen times before Kevin Vickers fatally wounded him,1568,unrelated
"Boko Haram Denies Ceasefire, Says Kidnapped Girls Are Now Married",320,unrelated
Has Ebola infected Isis militants in Mosul?,2025,discuss
Steve Jobs Biopic Eyes Seth Rogen to Play Apple Co-Founder Steve Wozniak,1197,unrelated
Report: Audio Reveals Pause Between Gunshots When Michael Brown Was Shot,968,unrelated
ISLAMIC STATE BEHEADS MISSING AMERICAN JOURNALIST JAMES WRIGHT FOLEY,1358,unrelated
"Nun gives birth, intends to keep baby",731,unrelated
"McDonald’s Removing Big Mac, Apple Pies And Eliminating Large Size Options",776,unrelated
"Boko Haram Denies Truce, Says Kidnapped Girls Have Been “Married Off”",2314,unrelated
"Islamic Tribunal Using Sharia Law In Texas Has Been Confirmed Tribunal members say they will avoid Sharia's ""criminal law.""",1049,unrelated
Pentagon: 1 weapons bundle seized by militants,1708,unrelated
An accidental delivery of arms to the Islamic State and the problem with airdrops,513,unrelated
"Catholic Priest Dead For 48 Minutes, Is Miraculously Revived – His Revelations About God Are Even More Shocking",993,unrelated
"James Wright Foley, Kidnapped Journalist, Apparently Executed by ISIS",1569,unrelated
Video shows ISIL beheading of photojournalist James Foley,2127,unrelated
Iraq Says Arrested Woman Is Not The Wife of ISIS Leader al-Baghdadi,170,unrelated
Cheese blamed for North Korean leader Kim Jong-un's broken ankles,524,unrelated
Opposition group: ISIS militants training to fly warplanes in Syria,805,unrelated
'Hairgate': iPhone hit by new social media storm,431,unrelated
"Gill Rosenberg, former IDF soldier, possibly captured by ISIS while fighting with Kurds",573,unrelated
GRAPHIC CONTENT: Girl sneers at man's tiny penis so he CHOPS IT OFF and bins it,1249,unrelated
WHO investigates media reports ISIS fighters contracted Ebola,267,unrelated
Mexican cartel leader kills self; bodies in grave not missing students,1825,unrelated
Lego letter from the 1970s still offers a powerful message to parents 40 years later,547,discuss
"Dead for 48 minutes, Catholic Priest claims God is female",478,unrelated
Seth Rogen to play Woz in Jobs biopic,1489,unrelated
Eye-catching! Rare sighting of Anna Wintour without her trademark sunglasses as she leaves 'rat-infested' Vogue office,304,unrelated
Magic Mushrooms Found on Buckingham Palace Grounds,2480,discuss
Shots Heard In Alleged Brown Shooting Recording [AUDIO],2118,discuss
"Meet Magneto Boy, the kid who attracts metal with his body",1433,agree
Oscar winner Christian Bale to play Steve Jobs in upcoming biopic,2211,disagree
"Gold Apple Watch Edition price? Speculators say at least $10,000",333,unrelated
Now THAT'S a Royal trip! Alan Titchmarsh finds psychedelic mushroom in the Queen's garden at Buckingham Palace,2478,agree
"Meteorite Strikes Nicaraguan Capital, Creates 16-Foot-Deep Crater",816,unrelated
Seth Rogen set to play Steve Wozniak in Danny Boyle's Steve Jobs biopic,1002,discuss
If Only A Bird Really Did Poop on Putin,1957,agree
Pumpkin Spice condoms? Don't fall for this hoax.,831,unrelated
A Man Says Comcast Called His Boss And Got Him Fired After He Complained About Its Service,1355,unrelated
Google Grows With $1.6 Billion in California Office Deals,586,unrelated
DNA tests prove Lebanon IS holding ISIS chief al-Baghdadi's ex-wife and daughter after they were caught with fake passports,1471,unrelated
"Mass Graves Found In Mexico, Near Place Where 43 Students Went Missing",702,discuss
"Boko Haram leader denies ceasefire deal, says 200 abducted girls married off ",40,unrelated
"Boko Haram: Kidnapped Girls Have Been Married Off, Truce Never Happened",720,unrelated
Missing American journalist reportedly beheaded by Islamic State ,1857,unrelated
