Headline,Body ID,Stance
Soldier shot near Canadian parliament building,2299,unrelated
REPORT: Alleged New Audio of Michael Brown Shooting,1438,unrelated
Meteorite strike in Nicaragua puzzles experts,2475,disagree
Moment Michael Brown was shot dead 'caught on audio recording': FBI handed potentially damning tape of ELEVEN shots being fired - including final volley of 'kill shots',2481,discuss
Pure Evil: Islamic State Beheads American Journalist James Wright Foley,1787,unrelated
"North Korean leader Kim Jong-un’s mystery illness actually two broken ankles, newspaper says",1837,unrelated
Michael Phelps' self-proclaimed girlfriend says she was born a BOY and reveals 'amazing' sex with Olympian,2528,unrelated
WATCH: Bird Launches Airstrike on Putin’s Shoulder (UPDATED),529,unrelated
#HairGate: iPhone 6 Customers Are Complaining That The Phone Is Ripping Out Their Hair,1439,unrelated
"No, A Spider Did Not Burrow Under A Man's Skin And Live There For Days",2329,unrelated
Actor has his testicles stolen after meeting ‘young blonde woman at a bar’,2419,unrelated
Small Meteorite Strikes in Nicaragua's Capital City of Managua,731,unrelated
"US Drones, Hunting for ISIS Leader, Seen Flying over Syrian Airspace",612,unrelated
Source: Tom Brokaw Wants Brian Williams Fired,1570,discuss
"Led Zeppelin Reunion: Robert Plant Rips Up $300 Million Contract, Refuses To Rejoin Legendary Band",169,unrelated
"Islamic State leader's family detained by Lebanon, officials say",720,discuss
Heartwarming video shows son revealing he’s paid off parent’s mortgage as a Christmas gift,950,unrelated
Eyewitness Says Viral Video of Homeless Man Was Staged,195,unrelated
Female teacher facing sack after making SEX TAPE with teenager,1896,unrelated
"Report: Stainless steel Apple Watch will be priced $500, gold at $5,000",1651,unrelated
Christian Bale to Play Steve Jobs in New Movie,1854,unrelated
Man has his PENIS cut off by angry mob after 'attempted rape' of teenager,125,unrelated
ISIL video claims beheading of kidnapped journalist James Foley,991,discuss
Luke Somers: British-born photojournalist 'killed by al-Qaeda after failed rescue attempt in Yemen',1256,unrelated
"Fidel Castro Is Dead, According to Viral Twitter Rumors",2251,discuss
"Vice's Shane Smith drops $300,000 on Vegas dinner",851,unrelated
Weather Channel’s Mike Seidel was not caught with his pants down,527,unrelated
Small Meteorite Strikes in Nicaragua's Capital City of Managua,1221,unrelated
Meteorite leaves crater in Nicaraguan capital Managua,2475,disagree
TBS Is Probably Speeding Up ‘Seinfeld’ Reruns To Fit In More Commercials,2307,unrelated
Boko Haram 'ceasefire' doubts after attacks reported in Nigeria,821,unrelated
Did Kim Yo-Jong Take Kim Jong Un’s Role? North Korea Ill Health Rumors Are ‘Fabricated’,2046,unrelated
Apple may launch 12-inch MacBook Air with Retina Display,1900,unrelated
NET Extra: Back-from-the-dead Catholic priest claims God is a female...,34,unrelated
Judd Nelson rebuffs Internet rumors that he died of a drug overdose.,1382,discuss
"Woman detained in Lebanon is not al-Baghdadi's wife, Iraq says",2240,unrelated
"Boko Haram leader denies ceasefire deal, says 200 abducted girls married off ",320,unrelated
"Gill Rosenberg, Canadian-Israeli Woman Feared Kidnapped By ISIS, Says She's Safe",1009,unrelated
"Apple to Take Reservations for Trying On Apple Watch, Considered Platinum Model",564,unrelated
Did Kim Yo-Jong Take Kim Jong Un’s Role? North Korea Ill Health Rumors Are ‘Fabricated’,1256,unrelated
ISIS fighters 'have contracted Ebola': World Health Organisation investigating reports militants showed up at Iraqi hospital with lethal disease,1893,unrelated
BREAKING NEWS: ISIS beheads missing American journalist James Wright Foley as warning to US to cease action in Iraq,1873,unrelated
Cesar Millan is Not Dead: Dog Whisperer Death Hoax Circulates,520,unrelated
ISIS cracks down on five confirmed Ebola cases among fighters: official,1019,unrelated
ISIL video claims beheading of kidnapped journalist James Foley,1873,unrelated
Matt Taibbi takes a leave of absence from First Look Media,2218,discuss
Batmobile Rumored To Have Been Stolen From Batman V. Superman: Dawn Of Justice Set,483,unrelated
Cannibal mum tries to EAT her own baby shortly after giving birth,1029,unrelated
Israeli-Canadian Woman 'Captured' By ISIS Says She Is 'Safe And Secure',1893,discuss
Journalist James Wright Foley reportedly beheaded by ISIS,1040,unrelated
"No, that broken pencil illustration isn't by Banksy",1867,unrelated
Expert casts doubt on Bunbury man Dylan Thomas’s burrowing stomach-spider story,1104,agree
Michael Brown shooting audio caught on tape?,1009,discuss
"Islamic State Training Pilots in Military Jets, Monitors Say",2342,unrelated
Has North Korean dictator Kim Jong-un been replaced by his sister?,706,unrelated
"Fidel Castro Is Dead, According to Viral Twitter Rumors",1439,unrelated
Islamic State Declares Captured Aid Worker to be 'Innocent',1095,unrelated
"Luke Somers Dies In Rescue Attempt, Sister Says; Yemeni Defense Ministry Says Unnamed US Hostage Freed",40,unrelated
US confirms death of Somalia terror group leader,839,agree
"ISIS beheads American photo-journalist James Wright Foley, threatens more to come",2525,unrelated
"North Korean leader Kim Jong-un’s mystery illness actually two broken ankles, newspaper says",1634,unrelated
White House Fence Jumper Pushed Past Female Guard,1804,unrelated
New ISIS Video Shows Militants Seizing Weapons Airdropped By US Near Kobani,1572,unrelated
Parliament Hill shooting: Sergeant-At-Arms Kevin Vickers the family hero who took down Ottawa gunman,2404,unrelated
"Dead for 48 minutes, Catholic Priest claims God is female",1877,unrelated
Durex Is Not Making Pumpkin Spice Condoms After All: A Hoax Debunked,2240,unrelated
Mexico finds 4 more graves at site of suspected student massacre,2266,unrelated
Tiger Woods selling Swedish villa — island included,2508,unrelated
Audio recording allegedly captures moment Michael Brown was shot,1818,discuss
Nicaragua Meteorite Impact Theory May Be Meteor-wrong,1009,unrelated
Texas Truck Winds Up in Syria With Islamic Militants,2145,agree
UPDATE: Internet report of Ebola outbreak in Purdon not true,2234,unrelated
Star Wars: The Force Awakens to be released this summer?,119,unrelated
"Dead for 48 minutes, this Catholic Priest claims God is female",398,unrelated
"Rats at Vogue's NYC offices - watch your step, Anna Wintour",1355,unrelated
Islamic State Militants Claim to Have Beheaded US Journalist James Wright Foley,1857,unrelated
"Why the most expensive Apple Watch will probably cost around $10,000",1438,unrelated
"Despite ceasefire announcement, new Boko Haram attacks reported",2356,discuss
Nicaragua Meteorite Impact Theory May Be Meteor-wrong,1594,agree
HORROR: ISIS Fighters Have Reportedly Contracted Ebola,2060,discuss
NYC High School Student Nicknamed ‘Teen Wolf’ Made $72 Million On Stock Market,821,unrelated
"Fidel Castro Rumors Sweep Internet, but No Sign in Cuba",1483,unrelated
Rapper identified as James Foley's executioner: reports,850,discuss
Media outlets identify 'Jihadi John',882,discuss
This Is The Most Epic Way To Quit Your Job,1212,unrelated
A Wanted Man Responded To A Police Facebook Post That He Would Turn Himself In,828,agree
ISIS Beheading of U.S. Journalist James Foley Posted to YouTube,1549,unrelated
MPs credit sergeant-at-arms for saving lives in Parliament Hill shootings,2113,discuss
Isis claims to behead US journalist,938,unrelated
"Obama, Outraged Over Beheading, Vows to Stay on Course",1547,unrelated
Watch moment TV weatherman is caught urinating in the bushes LIVE on camera,1476,unrelated
Tourist dubbed ‘Spider Man’ after spider burrows under skin for days,1848,unrelated
Weatherman caught peeing live on camera,1289,unrelated
Video: Marine survives Taliban sniper headshot thanks to helmet,2526,unrelated
Who Should Play Steve Jobs Now That Christian Bale Quit?,137,unrelated
"UPDATED 'Jihadi John' identified as Mohammed Emwazi of London, reports say",1933,unrelated
Islamic State releases video apparently showing the beheading of missing US journalist James Foley,2047,discuss
Pentagon: 1 weapons bundle seized by militants,2168,discuss
"No, A Spider Did Not Burrow Under A Man's Skin And Live There For Days",859,unrelated
"Dogs DO go to heaven… and cats, and horses: Pope assures young boy that there is a place in paradise for animals as well",2473,unrelated
Daash Ebola transferred to Mosul {Google Translate],2463,unrelated
ISIS Beheads American Journalist,704,unrelated
Has Kim's SISTER taken over North Korea? Dictator fails to show for key Communist event (but does send a nice flower basket instead),1029,unrelated
Steve Jobs Biopic Eyes Seth Rogen to Play Apple Co-Founder Steve Wozniak,1157,unrelated
Dylan Thomas Finds Tropical Spider Burrowed Under Skin,2459,unrelated
"Hoax Report Claims 250,000 Texas Turkeys Infected With Ebola",2035,unrelated
Kimye’s Fault? Anna Wintour’s NYC ‘Vogue’ Offices Hit With Disgusting Rat Infestation: ‘Rat Droppings On Desks’,2187,unrelated
Iraqi media: ISIS militants have contracted Ebola,1974,discuss
"Islamist Militants 'Steal' 11 Commercial Planes In Libya, Sparking Terror Attack Fears",1588,unrelated
Tiger Woods' former luxury island goes on sale,1802,unrelated
The Arrest of the ISIS Leader's Wife and Son,1004,discuss
"BREAKING: ""Brat Pack"" Judd Nelson Found Dead in Los Angeles Condo",2481,unrelated
"Jihadi John named as Mohammed Emwazi, from west London",2125,unrelated
"ISIS Claims It Kidnapped Gill Rosenberg, The First Western Woman To Fall Into The Group's Hands",1223,unrelated
"Whoa, Paul Rudd Was One of the Airport Heroes Who Took Down the Homophobe",1814,unrelated
Hundreds mourn the 'death' of Fidel Castro after rumours sweep Twitter (but are they confusing him with recently departed Fidel Castro Odinga from Nairobi?),2016,unrelated
"Reports Isis fighters have contracted Ebola are 'incorrect', says Iraqi health ministry",5,unrelated
Reports: Islamic State uses chlorine gas against Iraqi forces,1267,unrelated
God Is A Woman – Resurrected Father Narated,2515,disagree
"Sorry, KFC isn't going to be selling weed in Colorado restaurants",1873,unrelated
Christian Bale In Talks To Play Steve Jobs In Sony's Next Biopic,137,unrelated
Nicaragua asks U.S. for help investigating meteorite crater,373,unrelated
ESPN to save NFL's image with all-male domestic abuse discussion,825,unrelated
"Woman detained in Lebanon is not Isis leader’s wife, says Iraq",1125,unrelated
"Sons of Anarchy Movie? No, Kurt Sutter Announces Charlie Hunnam, Brad Pitt Film Article is Fake",1837,unrelated
Emotional sergeant-at-arms is greeted back to parliament with a rousing standing ovation a day after he heroically shot dead terrorist - the first time he used weapon in 30 year career,2113,discuss
Pentagon: 1 weapons bundle seized by militants,1026,unrelated
Meet the 17-Year-Old Who Made $72 Million During His High-School Lunch Breaks,2115,unrelated
Report—Jose Canseco accidentally shot at his home tonight,1772,unrelated
"Dogs DO go to heaven… and cats, and horses: Pope assures young boy that there is a place in paradise for animals as well",932,unrelated
Comcast gets customer fired for complaining about poor service,1355,unrelated
Pants on Fire: Duncan Hunter makes unconfirmed claim Border Patrol caught at least 10 ISIS fighters,1893,unrelated
ISIL allegedly kills US journalist in video,1720,unrelated
Nun who GAVE BIRTH to baby boy after suffering agonising stomach pains 'had no idea' she was pregnant,1597,unrelated
Comcast Declares War on Tor?,1359,discuss
ISIS fighters 'have contracted Ebola': World Health Organisation investigating reports militants showed up at Iraqi hospital with lethal disease,267,unrelated
Amazon.com to open first physical store in Manhattan: DJ,267,unrelated
The Chinese Guide to Avoiding a Bad English Name,1170,unrelated
Second person rushed to hospital with Ebola symptoms after contact with 'patient zero' Thomas Duncan,527,unrelated
"Planetary Alignment On Jan 4, 2015 Will Decrease Gravity For 5 Minutes Causing Partial Weightlessness",1323,unrelated
ISLAMIC STATE BEHEADS MISSING AMERICAN JOURNALIST JAMES WRIGHT FOLEY,1948,discuss
"Rumor: Gold Apple Watch Edition priced up to $5,000, steel version at $500, will debut on Feb. 14",281,unrelated
Bali spider burrows under Aussie’s chest,1549,unrelated
Texas Truck Winds Up in Syria With Islamic Militants,803,unrelated
Everyone chill! Banksy has NOT been arrested,1435,unrelated
Was The Video Of That Homeless Man Doing Good Deeds With $100 All An Elaborate Hoax!?,1245,disagree
Oscar winner Christian Bale to play Steve Jobs in upcoming biopic,860,discuss
Boko Haram 'to release abducted schoolgirls' as part of ceasefire agreement,1003,unrelated
Michelle Obama's Hair Appeared Totally Uncensored on Saudi TV,1498,unrelated
Apple 'working on 12-inch MacBook Air',1852,unrelated
Audio may have captured Michael Brown shooting,1131,unrelated
"Amazon reportedly launching free, ad-supported video service (updated)",1971,unrelated
Boko Haram 'ceasefire' doubts after attacks reported in Nigeria,800,unrelated
Officials Refute Iraqi Media Reports That ISIS Members Have Contracted Ebola In Mosul,2060,agree
"Insiders Claim Steel Apple Watch to Start at $500, Gold at $4,000",296,discuss
GOP Rep: ‘At Least Ten ISIS Fighters Have Been Caught Coming Across The Mexican Border’,220,unrelated
Shocking Photos! Mom Tries To Sell Son To Pay For Daughter's Cancer Treatment,1698,agree
Mum faces real-life Sophie's Choice – as she tries to sell her son to fund daughter's care,2115,unrelated
Libya: Missing Libya Planes Spark Security Concerns,2208,agree
Missing Mexican students 'not found in mass grave',1912,discuss
Is Kim Jong-un Opening North Korean Restaurant in Scotland?,532,unrelated
N Korean leader misses annual ritual; sister ‘takes over duties’,2046,unrelated
Not coming to a store near you: The pumpkin spice condom,2338,unrelated
Apple may launch 12-inch MacBook Air with Retina Display,1863,unrelated
Weather Reporter Caught Writing His Name In The Snow Was NOT Ready To Go On Camera (UPDATED),1829,disagree
’6 Days Darkness in December 2014′ 100% Fake; NASA Confirmed 3 Days Total Darkness Hoax as Well,1689,unrelated
I aborted my baby because it was a boy,2161,unrelated
Surreal Photos of Fisherman’s Jaw-Dropping Catch Will Likely Have People Wondering If It’s Real,1221,unrelated
US drones hunt Isis leader in Syria,35,unrelated
"Woman detained in Lebanon is not al-Baghdadi's wife, Iraq says",2155,discuss
"Rumor: Gold Apple Watch Edition priced up to $5,000, steel version at $500, will debut on Feb. 14",62,unrelated
"Apple Watch Stainless Steel variant reportedly priced at $500, $4,000 for the gold variant",403,unrelated
Watch NAKED airport worker walk through scanner in bizarre protest against 'rough' guards,511,agree
Oscar winner Christian Bale to play Steve Jobs in upcoming biopic,1846,disagree
Man Known as ‘Jihadi John’ Is Identified as Mohammed Emwazi,1506,unrelated
Missing American journalist reportedly beheaded by Islamic State ,2450,discuss
Man Known as ‘Jihadi John’ Is Identified as Mohammed Emwazi,320,unrelated
Missing jetliners raise fear of new 9/11-style attacks after Libyan airport falls to Islamic militants,1575,unrelated
"Apple Watch Specs Tipped; Said to Feature 512MB RAM, 4GB of Storage",1681,unrelated
"Gill Rosenberg, Canadian-Israeli Woman Feared Kidnapped By ISIS, Says She's Safe",214,unrelated
Boko Haram 'to release abducted schoolgirls' as part of ceasefire agreement,1019,unrelated
Islamic State Militants Claim to Have Beheaded US Journalist James Wright Foley,2047,discuss
Report: Michael Phelps’ Tinder ‘Girlfriend’ Was Born Male; “We Made Love During Halftime”,1349,discuss
Angry mob cut off rapist’s penis with meat cleaver (VIEWER DISCRETION),2196,unrelated
Report: Tom Brokaw Wants Brian Williams Fired,2176,discuss
Angry mob chops off man's genitals with butcher’s knife for alleged rape attempt,1042,unrelated
Islamic State fighters training to fly captured jets — watchdog,886,unrelated
Angry mob hacks off alleged rapist's genitals with meat cleaver after dragging him into butchers,1829,unrelated
Christian Bale Pulls Out of Upcoming Steve Jobs Biopic,571,unrelated
SHOCKING: Indian Man's Penis Cut-off After He Was Caught Attempting Rape [Photos],17,unrelated
"CNN Broadcasts Purported Audio Containing Gunshots That Felled Michael Brown Jr.; Leaders, Celebrities Fill Pews At Teen’s Funeral",450,unrelated
"Comcast Is Threatening To Cut Off Customers Who Use Tor, The Web Browser For Criminals",1104,unrelated
Microsoft Hires Dalek-style Robocops to Guard Silicon Valley HQ,1837,agree
NYC High School Student Nicknamed ‘Teen Wolf’ Made $72 Million On Stock Market,945,unrelated
ISIS Appears To Behead American Photojournalist In YouTube Video,1569,unrelated
"ISIS Militants In Mosul Have Contracted Ebola, Iraqi Media Sources Claim",5,unrelated
CNN Expert on Brown Audio: At First I Thought ‘Someone’s Trying to Punk CNN’,2220,discuss
"Meteorite Strikes Nicaraguan Capital, Creates 16-Foot-Deep Crater",1427,unrelated
Nigeria: hopes for return of kidnapped schoolgirls rise after ceasefire reported,171,unrelated
ISIS Beheading of U.S. Journalist James Foley Posted to YouTube,26,unrelated
US probing claims ISIS fighters seized airdropped weapons meant for Kurds,2295,discuss
"Viral Video Of Homeless Man Spending $100 On Food For Other Homeless Was Faked, Witness Says",1637,unrelated
Bunbury local discovered a spider had burrowed under his skin on Bali holiday,730,unrelated
Spider burrowed through tourist's stomach and up into his chest,1478,agree
Audio may have captured Michael Brown shooting,1808,unrelated
Christian Bale Drops Out of Steve Jobs Biopic,1897,unrelated
Pope says dogs can go to heaven: ‘Paradise is open to all of God’s creatures’,2348,unrelated
NBC weatherman caught urinating in the woods live on air,1934,unrelated
7 teen girls get pregnant on school trip Read more at http://www.wnd.com/2014/12/7-teen-girls-get-pregnant-on-school-trip/#F5filOd6yFpASPV9.99,571,unrelated
"Prankster Gives Homeless Man $100, Secretly Follows Him And Learns He Buys Food For Others",344,unrelated
Saddam Hussein’s pilots training Islamic State group,886,unrelated
Kim Jong-Un's Scottish Dog Meat Restaurant Is Probably Fabricated Shite,81,unrelated
"Apple Watch to Be Shower-Proof, Have 100,000 Apps at Launch: Reports",524,unrelated
Airport worker strips naked at security scanner in protest against guards,958,unrelated
Ebola Frisco 2014: Patient Shows Virus Symptoms After Apparent Thomas Eric Duncan Contact,381,unrelated
New policy could reduce marijuana possession arrests,2097,unrelated
Government fires employee who skipped work for 24 years,2186,unrelated
Parliament Hill shooting: Sergeant-At-Arms Kevin Vickers the family hero who took down Ottawa gunman,40,unrelated
Bug in iOS 8's 'Reset All Settings' Option Also Erases iCloud Drive Documents,2163,unrelated
India Rape Crisis Sees Mob Castrate Alleged Sex Attacker in Shocking Scenes,689,unrelated
Newly Discovered Mass Grave Linked to Missing Mexican Students,1849,unrelated
"No, a bird didn't poop on Vladimir Putin",1028,unrelated
Chugging eggnog sends Utah man to hospital,2509,unrelated
Durex is not confirming or denying rumors of a “pumpkin spice” condom,1708,discuss
"Amazon reportedly launching free, ad-supported video service (updated)",531,unrelated
Apple Orders More Than 5 Million Watches for Initial Run,1395,discuss
Pope says dogs can go to heaven: ‘Paradise is open to all of God’s creatures’,932,unrelated
ISIS Blasts 'Scorpion Bombs' At Civilian Areas In Iraq; Mosul Residents Living In Fear,2187,unrelated
[UPDATED] 11 Men and 0 Women on Tonight's ESPN Domestic Violence Panel,959,unrelated
"Woman, Ting Su, Finds Husband Cheating With Her Own Twin, Gets Spectacular Revenge",1725,agree
"See How This Homeless Man Spends A Hundred Dollars, And Keep A Tissue Handy [Video]",1820,unrelated
A Murdered Witness?,662,unrelated
Lebanon detains wife and son of Al-Baghdadi,1192,discuss
Give a homeless man $100 and see what he does with it [Video],941,unrelated
Kim Jong-Un 'in hospital with two fractured ankles' after ballooning to around 20 stone and going on numerous 'meet the people' walkabout PR stunts,2501,unrelated
Kim Had Ankle Surgery:  Source,1854,discuss
"Is Kim Jong-un's Sister, Kim Yo-jong, Running North Korea In His Mysterious Absence?",1152,discuss
Nigeria Says Boko Haram Cease-Fire May Lead to Release of Kidnapped Girls,1906,unrelated
"What was fake on the Internet this week: Obama’s peace prize, pumpkin-spice condoms and insane winter snow",1247,agree
"Despite ceasefire announcement, new Boko Haram attacks reported",821,unrelated
Pentagon Denies It Killed ISIS Chief As Airstrikes Hit Top Extremists,511,unrelated
Isis tells mother on rescue mission :’You’ve just eaten your son’,1574,unrelated
Guru who ordered 400 followers to be castrated 'so they could be closer to God' is investigated for grievous bodily harm in India,1528,unrelated
"Boko Haram Cease-Fire: Abducted Nigerian Schoolgirls To Be Released, Officials Say",1019,unrelated
Small Meteorite Hits Managua,2155,unrelated
Anna Wintour: Is Rat Infestation At NYC ‘Vogue’ Office Kim Kardashian’s Fault?,964,unrelated
Nigeria says it has deal with Boko Haram to release kidnapped girls,2088,unrelated
Gateway Pundit,1649,unrelated
Axl Rose Dead? Of Course Not — Tiresome Internet Death Hoax Plague Hits Guns N’ Roses Frontman,1857,unrelated
NYC High School Student Nicknamed ‘Teen Wolf’ Made $72 Million On Stock Market,1439,unrelated
Isis claims US hostage Kayla Mueller killed in coalition airstrike,524,unrelated
Amazon plans ad-supported video streaming service - NY post,687,unrelated
Michael Zehaf-Bibeau was shot nearly a dozen times before Kevin Vickers fatally wounded him,1175,unrelated
"Prankster Gives Homeless Man $100, Secretly Follows Him And Learns He Buys Food For Others",1948,unrelated
Christian Bale in Talks to Play Steve Jobs (Exclusive),218,unrelated
Abdel-Majed Abdel Bary in Foley beheading: London rapper songs help identify him,1202,discuss
Christian Bale In Talks To Play Steve Jobs In Sony's Next Biopic,1234,unrelated
Audio recording allegedly captures at least 10 shots fired in Michael Brown killing,1828,unrelated
"Jeh Johnson: Politicians Shouldn't 'Feed The Flames Of Fear' Over ISIS, Ebola",2385,agree
"Small meteorite strikes Nicaragua, government says",1347,unrelated
Kim Jong-un So Fat He Injured His Ankles,2210,unrelated
Woman spends a week in KFC to get over her break up,2043,agree
"Boko Haram Denies Truce, Says Kidnapped Girls Have Been “Married Off”",381,unrelated
CNN Posts Alleged Audio of Michael Brown Shooting,2495,unrelated
More than 200 kidnapped Nigerian girls to be released after deal reached with Boko Haram,1883,unrelated
Hilarious: North Dakota Pays Special Tribute to President Obama,2443,unrelated
Alleged audio of Michael Brown shooting released,1921,unrelated
Report: Christian Bale Just Bailed on the Steve Jobs Movie,1996,unrelated
IRAQI HEALTH OFFICIAL: EBOLA HAS KILLED 5 ISIS FIGHTERS,2177,unrelated
ISIL Beheads American Photojournalist in Iraq,1660,unrelated
Amazon to Open First Brick-and-Mortar Site,2448,unrelated
ISIS Video Purports To Show Beheading Of British Aid Worker,1182,discuss
WHO ‘probing’ whether ISIS fighters got Ebola,1365,unrelated
"ISIS beheads American photo-journalist James Wright Foley, threatens more to come",2047,discuss
"Apple to Take Reservations for Trying On Apple Watch, Considered Platinum Model",385,unrelated
WHO says reports of suspected Ebola cases in Iraq are untrue,527,unrelated
Alleged audio of Michael Brown shooting has surfaced,2235,discuss
FBI Probing Alleged Audio of Michael Brown Shooting,942,unrelated
Christian Bale quits Steve Jobs movie,1289,unrelated
Street Artist BANKSY Arrested? Again?,1269,unrelated
WATCH: Bird Launches Airstrike on Putin’s Shoulder (UPDATED),1843,unrelated
ISIL Beheads American Photojournalist in Iraq,2386,agree
Star Wars VII for a New SUMMER Release Date!?,2463,unrelated
Eyewitness Says Viral Video of Homeless Man Was Staged,676,unrelated
Microsoft's Silicon Valley campus now guarded by Daleks,1195,unrelated
"Thanks Uncle Sam, we have your weapons airdrop: ISIS taunts America over intercepted weapons meant for Kurds",125,unrelated
New Audio Recording From Ferguson May Capture Michael Brown Shooting,1379,discuss
That Boko Haram Ceasefire in Nigeria Isn’t A Ceasefire,837,agree
Missing Libyan Jetliners Raise Fears of Suicide Airliner Attacks on 9/11,723,unrelated
Banksy arrest hoax: Internet duped by fake report claiming that the street artist's identity has been revealed,30,unrelated
"Boko Haram denies truce, says kidnapped girls married",304,unrelated
Mexico prosecutor: Students not in 1st mass graves,251,unrelated
That Boko Haram Ceasefire in Nigeria Isn’t A Ceasefire,1139,discuss
From bendgate to hairgate: Now iPhone 6 users complain the device is ripping out their hair,1260,unrelated
Christian Bale in Talks to Play Steve Jobs (Exclusive),7,unrelated
URGENT: ISIS kills 300 Iraqi soldiers by chlorine gas attack in Saqlawiyah,1357,unrelated
Sugarhill Gang co-founder Big Bank Hank dies,234,unrelated
Iraq Says Arrested Woman Is Not The Wife of ISIS Leader al-Baghdadi,1877,agree
North Korea dictator Kim Jong-un undergoes surgery after breaking both ankles on military tour,1689,unrelated
IRAQI HEALTH OFFICIAL: EBOLA HAS KILLED 5 ISIS FIGHTERS,2175,unrelated
NASA Raises Doubts About Reports of Nicaraguan Meteorite,1825,discuss
Shots Heard In Alleged Brown Shooting Recording [AUDIO],1266,unrelated
"Small meteorite strikes Nicaragua, government says",1722,discuss
"No, Banksy hasn’t been arrested",900,agree
Hoax 'Banksy Arrested in London' Story Dupes the Internet Again,1301,agree
