Headline,Body ID,Stance
Claim: Comcast Got Complaining Customer Fired From His Job,2133,discuss
Aaron Sorkin Confirms Christian Bale Will Play Steve Jobs,1234,unrelated
Identity of ISIS terrorist known as 'Jihadi John' reportedly revealed,1815,unrelated
Bug in iOS 8's 'Reset All Settings' Option Also Erases iCloud Drive Documents,1155,unrelated
Ferguson riots: audio may have captured Michael Brown shooting,944,discuss
Isis militants claim to have killed US journalist James Foley,874,unrelated
Ottawa Gunman Identified As Michael Zehaf-Bibeau,1329,discuss
A Mass Grave Points to a Student Massacre in Mexico,683,unrelated
The Arrest of the ISIS Leader's Wife and Son,1913,unrelated
Jihadi John: Mohammed Emwazi named as masked man behind ISIS beheadings,1465,unrelated
That’s one way to clean it: Apple Watch will reportedly survive a trip through the shower,405,unrelated
"Nigeria claims deal with Boko Haram on ceasefire, kidnapped girls",2314,unrelated
New policy could reduce marijuana possession arrests,666,unrelated
How did a Texas plumber's truck end up with Syrian rebels? (+video),565,unrelated
CNN Posts Alleged Audio of Michael Brown Shooting,1564,discuss
FBI Probing Alleged Audio of Michael Brown Shooting,1808,unrelated
Has North Korean dictator Kim Jong-un been replaced by his sister?,1289,unrelated
Isis Syria News: Iraqi Pilots 'Training Isis Fighters' to Fly Captured Planes,140,discuss
Someone Trolled Twitter Into Thinking Macklemore Joined ISIS,1022,unrelated
Did Comcast Get a Man Fired From His Job for Complaining About Its Service?,1268,unrelated
Israeli Canadian fighting ISIS posts on Facebook: I'm safe and secure,1240,unrelated
BREAKING UDPATED: ISIS REPORTEDLY USE CHEMICAL WEAPONS IN KOBANE,1968,unrelated
Christian Bale in Talks to Play Steve Jobs (Exclusive),2097,unrelated
Isis claims US hostage Kayla Mueller killed in coalition airstrike,2473,unrelated
Audio recording allegedly captures at least 10 shots fired in Michael Brown killing,1299,unrelated
Christian Bale Drops Out of Steve Jobs Biopic,2455,discuss
U.S. Hostage Luke Somers Killed During Yemen Rescue Bid: Family,2304,unrelated
"Explosion reported near the Nicaraguan capital attributed to meteorite impact, but experts, including NASA, cast doubt on claims",1622,discuss
Woman Spends Entire Week In KFC After Getting Dumped By Her Boyfriend,2043,agree
Was The Batmobile Stolen In Detroit?,1751,discuss
Texas Plumber Has ‘No Idea’ How Company Truck Ended Up With ISIS,13,unrelated
Militant Group Says It Killed American Journalist in Syria,1905,unrelated
Islamic State using 'SCORPION bombs' to terrorise victims,2453,unrelated
"Thanks Uncle Sam, we have your weapons airdrop: ISIS taunts America over intercepted weapons meant for Kurds",2009,unrelated
Meteorite leaves crater in Nicaraguan capital Managua,10,unrelated
Christian Bale to Play Steve Jobs in New Movie,296,unrelated
CNN Posts Alleged Audio of Michael Brown Shooting,2434,discuss
"Christian Bale in talks to play Steve Jobs for Sony, Danny Boyle",574,unrelated
IS Militants Kill 300 Iraqi Soldiers with Chlorine Gas,2016,unrelated
Police hunt tweed-jacket wearing man who slaps shoppers for SNEEZING,2277,unrelated
"Whoa, Paul Rudd Was One of the Airport Heroes Who Took Down the Homophobe",1094,discuss
Devoted pet owner spends £300 to save his GOLDFISH after it became constipated,2410,unrelated
NEWS/ Meet the Teletubbies Sun Baby: 19-Year-Old Jess Smith Reveals Herself as the Smiling Face Who Looked Over Teletubbyland,1834,unrelated
Latest iOS 8 bug reportedly causes unwanted deletion of iCloud Drive documents,2061,unrelated
ADVISORY-Islamist rebel leader killed in U.S. strike - Somali government,60,unrelated
6 hidden mass graves may hold missing Mexican students,61,unrelated
WHO says reports of suspected Ebola cases in Iraq are untrue,1669,discuss
Luke Somers: British-born photojournalist 'killed by al-Qaeda after failed rescue attempt in Yemen',1746,unrelated
Cheese blamed for North Korean leader Kim Jong-un's broken ankles,1103,unrelated
MPs credit sergeant-at-arms for saving lives in Parliament Hill shootings,1002,unrelated
Missing Mexico students not among 28 bodies found in mass grave,1405,discuss
Rep. Duncan Hunter: 'At Least 10' ISIS Fighters Caught at Mexican Border,1637,unrelated
Rep. Duncan Hunter: 'At Least 10' ISIS Fighters Caught at Mexican Border,2254,unrelated
Fisherman lands 19 STONE catfish which could be biggest in world to be hooked,2161,agree
"No, Robert Plant Didn’t Rip Up an $800 Million Contract",734,discuss
Shots Heard In Alleged Brown Shooting Recording [AUDIO],2458,unrelated
James Foley remembered as 'brave and tireless' journalist,456,discuss
Lynch Mob Castrates Alleged Rapist In Rajasthan,2072,unrelated
'Sex attacker' has penis cut off with a cleaver in India,1760,unrelated
ESPN's Domestic Violence Panel Is Missing Something Important,373,unrelated
US officials: Video shows American's execution,2388,discuss
Rajasthan: Angry mob teaches rapist a lesson; chops penis off,1673,agree
Abdel Majed Abdel Bary Emerges as Suspect in Foley Beheading,1598,discuss
"No, Vladimir Putin did not get pooped on by a bird during a First World War speech",2472,unrelated
CNN Expert on Brown Audio: At First I Thought ‘Someone’s Trying to Punk CNN’,1974,unrelated
Texas Plumber Has ‘No Idea’ How Company Truck Ended Up With ISIS,803,unrelated
The Chinese Guide to Avoiding a Bad English Name,1954,unrelated
Chinese advised to choose British-sounding names to get ahead,254,unrelated
This Selfless Homeless Man Receives $100 & Doesn't Spend A Dime On Himself!,2132,disagree
"If you want an Apple Watch, you’ll probably be trekking to an Apple Store",1066,discuss
Abdel Majed Abdel Bary Emerges as Suspect in Foley Beheading,1530,discuss
North Korea dictator Kim Jong-un undergoes surgery after breaking both ankles on military tour,1001,discuss
#HairGate: iPhone 6 Customers Are Complaining That The Phone Is Ripping Out Their Hair,1015,unrelated
Weather Reporter Caught Writing His Name In The Snow Was NOT Ready To Go On Camera (UPDATED),1047,unrelated
Rumor: Seth Rogen to Appear as Woz in Sony's Steve Jobs Film,1157,unrelated
Man chops off his own penis after girlfriend told him he was no good in bed,522,discuss
Former PGA Tour player: Tiger Woods suspended for drug test failure,48,unrelated
Jihadi John: Mohammed Emwazi named as masked man behind ISIS beheadings,2033,unrelated
"Jihadi John named as Mohammed Emwazi, from west London",1724,discuss
Seth Rogen to Star as Steve Wozniak in Sony's Steve Jobs Biopic [Updated],1948,unrelated
Durex is not confirming or denying rumors of a “pumpkin spice” condom,2123,unrelated
Homeless man who received a meal and hotel stay after spending $100 donation on food for friends insists it was NOT a hoax – despite new witness insisting there was no way he could have been secretly filmed,1925,discuss
Christian Bale will not play Steve Jobs,1157,discuss
"BREAKING: Islamic State, in video, beheads American journalist James Wright Foley who was kidnapped in 2012 -@BNONews",7,unrelated
Sugarhill Gang co-founder Big Bank Hank dies,754,unrelated
"Sick Kansas City man said not to have Ebola, U.S. plans new steps to fight virus",2070,unrelated
Isis claims to behead US journalist,2404,unrelated
AWESOME! Canadian Parliament’s Sergeant-at-Arms Kevin Vickers Takes Out Gunman,1885,unrelated
Judicial Watch's Farrell: ISIS Terrorists Did Cross Mexican Border,1483,unrelated
'Jihadi John' named as Mohammed Emwazi from London,2202,discuss
KFC Gets Occupational Business License To Sell Marijuana In Colorado Restaurants KFC Gets Occupational Business License To Sell Marijuana In Colorado Restaurants,882,unrelated
Brian Williams Insists NBC News Meteorologist Did Not Pee in the Snow While on Air,1169,unrelated
Fears journalist James Wright Foley beheaded by Islamic State jihadists in ‘message’ to United States,1966,discuss
Predator Drone Reportedly Spotted Over ISIS Hotbed in Syria; Airstrikes Hit ISIS Targets,1657,discuss
Apple may launch 12-inch MacBook Air with Retina Display,1679,unrelated
"Tour, agent: Tiger Woods not banned",1589,unrelated
"CNN Broadcasts Purported Audio Containing Gunshots That Felled Michael Brown Jr.; Leaders, Celebrities Fill Pews At Teen’s Funeral",900,unrelated
BREAKING NEWS: ISIS beheads missing American journalist James Wright Foley as warning to US to cease action in Iraq,984,unrelated
Did Kim Yo-Jong Take Kim Jong Un’s Role? North Korea Ill Health Rumors Are ‘Fabricated’,706,unrelated
Amazon Reportedly Planning An Ad-Supported Video Service That Will Be Cheaper Than Netflix,887,unrelated
"Apple Reportedly Preparing 12-inch MacBook Air, Thinner and Lighter than Existing Models",1863,unrelated
ISIS chlorine attack on security forces confirmed – Iraq officials,636,discuss
More than 200 kidnapped Nigerian girls to be released after deal reached with Boko Haram,1019,unrelated
N. Korea’s Kim has leg injury but in control,1567,unrelated
UPDATE: BATMAN v SUPERMAN Batmobile Reportedly Stolen By (Shocker!) Detroit Locals,251,unrelated
Hunt for 'cruel' owner who abandoned dog at train station,530,unrelated
"A message from Jim's mom, Diane Foley:",1295,unrelated
"Apple Watch pricing: Will you spend $5000 for Gold edition, $500 for stainless steel?",577,discuss
What This Homeless Guy Did With $100 Completely Stunned The Man Who Gave It To Him,2305,agree
Israeli Canadian fighting ISIS posts on Facebook: I'm safe and secure,1106,discuss
Rodney Constantine keeps Facebook promise and turns himself in to police,2524,unrelated
N. Korea’s Kim has leg injury but in control,1678,unrelated
Jeh Johnson shoots down Duncan Hunter's assertion IS is entering U.S. via Mexico,2385,agree
CNN Posts Alleged Audio of Michael Brown Shooting,2235,discuss
Magic Mushrooms Found on Buckingham Palace Grounds,2528,unrelated
Breaking: Soldier shot at National War Memorial in Ottawa,595,unrelated
Sugarhill Gang rapper Big Bank Hank dies aged 57,239,unrelated
"In Vogue vs Rats War, the Rats Are Winning",2064,agree
British hostage David Haines beheaded by Islamic State terrorists,331,unrelated
US officials: Video shows American's execution,1351,unrelated
"Pictured: Heroic sergeant-at-arms, 58, walking through Parliament gun in hand just moments after he killed gunman Michael Zehaf-Bibeau",2404,unrelated
Is the Alleged Audio of the Gunshots That Killed Michael Brown a Hoax?,1817,discuss
Media Fooled Again? Story Claims 7 of 28 Girls On School Trip Came Home Pregnant,1277,unrelated
Nigeria announces truce with Boko Haram; fate of schoolgirls unclear,2045,unrelated
Meteorite strike in Nicaragua puzzles experts,1917,unrelated
This Letter To Parents From A 1970s Lego Set Contains An Important Message For Gender Equality,1804,unrelated
"Gill Rosenberg, former IDF soldier, possibly captured by ISIS while fighting with Kurds",413,unrelated
Airport worker strips naked at security scanner in protest against guards,132,unrelated
A bunch of cool health features were cut from the Apple Watch at the last minute,40,unrelated
Isis claims to behead US journalist,2495,discuss
"'American bombing had signed my death certificate': Missing US journalist James Wright Foley goes unflinching to his death as ISIS behead him in horrific video, as a warning to Obama",2096,discuss
Nun who gave birth ‘had no idea’ she was pregnant,1480,unrelated
ISIS Beheads American Journalist,533,unrelated
Hoax 'Banksy Arrested in London' Story Dupes the Internet Again,1808,unrelated
"Is North Korea, world's most secret state, really planning a new restaurant in Scotland?",17,unrelated
"Brian Williams: No, Our Meteorologist Was Not Peeing on Live TV",2092,unrelated
Strange mark turns out to be tropical spider burrowing under vacationer's skin,1708,unrelated
Report: Missing Libyan jetliners raise fears of suicide airliner attacks on 9/11,1644,unrelated
‘Star Wars: The Force Awakens’ May Get An Early Release Date—Report,1966,unrelated
Reports: Big Bank Hank of pioneering rap group Sugarhill Gang has died,40,unrelated
Apple’s next MacBook could be a 12-inch MacBook Air,2509,unrelated
"Boko Haram Cease-Fire: Abducted Nigerian Schoolgirls To Be Released, Officials Say",1357,unrelated
News sites fall for Putin bird-dropping video,1087,discuss
"Nigeria Says It Struck A Cease-Fire With Boko Haram, But Are They Talking To The Right Guy?",308,discuss
Hundreds mourn the 'death' of Fidel Castro after rumours sweep Twitter (but are they confusing him with recently departed Fidel Castro Odinga from Nairobi?),1024,unrelated
Lynch mob chop man's penis off after catching him allegedly trying to rape teenager,1500,unrelated
Ferguson riots: audio may have captured Michael Brown shooting,662,unrelated
Was Alleged Audio of Michael Brown Shooting on CNN a Hoax?,472,unrelated
Islamic Militants Post Video Claiming to Show Beheading of U.S. Journalist,2296,unrelated
This resignation letter in a video-game could be the greatest ever,562,unrelated
This Is The Most Epic Way To Quit Your Job,997,unrelated
Bali Awry,1602,discuss
Luke Somers' sister says he was killed in failed Yemen rescue attempt,1988,discuss
Large space object slams Nicaragua’s capital as asteroid passes Earth,2118,unrelated
"If you really believed Colorado KFCs were selling pot, here’s a reality check",487,unrelated
Islamic State releases video apparently showing the beheading of missing US journalist James Foley,1905,unrelated
Seven girls fall pregnant after five day school trip in Bosnia and Herzegovina,821,unrelated
James Foley remembered as 'brave and tireless' journalist,1658,agree
BiH: Seven Primary School Students Pregnant After Five-Day Excursion,2103,discuss
"ISIS beheads American photo-journalist James Wright Foley, threatens more to come",874,unrelated
"Batmobile Stolen From ""Batman v Superman: Dawn of Justice"" Set, Zack Snyder Knows Who Did It",1237,discuss
Lawmaker Says ‘At Least 10′ Islamic State Fighters Have Been Captured at the Southern U.S. Border,2296,unrelated
Italian catches huge wels catfish; is it a record?,1183,unrelated
Chinese State Media Warns People To Stop Calling Themselves Dumbledore,1916,unrelated
TBS Is Probably Speeding Up ‘Seinfeld’ Reruns To Fit In More Commercials,2360,unrelated
Lawmaker Says ‘At Least 10′ Islamic State Fighters Have Been Captured at the Southern U.S. Border,2056,unrelated
WHO ‘probing’ whether ISIS fighters got Ebola,1926,unrelated
Man Severed Penis That Failed To Impress Girls,714,unrelated
ISIS militants appear to behead abducted American journalist James Wright Foley in graphic video,1873,unrelated
Watch: US Marine saved by helmet after being shot by Taliban sniper,709,unrelated
Meteorite strike in Nicaragua puzzles experts,220,unrelated
It’s About To Get Harder To Be Arrested For Pot Possession In New York City,1646,unrelated
Man chops off own penis after being dumped by his girlfriend,760,unrelated
Constipated goldfish operated on by North Walsham vet,1467,unrelated
Unconfirmed reports saying ISIS UK Hostage David Haines Beheaded,2477,unrelated
"No, A Spider Did Not Burrow Under A Man's Skin And Live There For Days",214,unrelated
"Michael Phelps' self-proclaimed 'girlfriend', 41, reveals she was born a male as she describes her 'amazing intimacy' with Olympic swimmer",645,unrelated
Mexico checks if 43 missing students in mass grave,1427,discuss
Alleged audio of Michael Brown shooting has surfaced,1438,unrelated
Breaking: Soldier shot at National War Memorial in Ottawa,2492,unrelated
‘Star Wars: The Force Awakens’ May Get An Early Release Date—Report,1406,unrelated
Dumped woman spends a week in KFC to get over ex,1689,unrelated
"Gill Rosenberg, Canadian-Israeli Woman Feared Kidnapped By ISIS, Says She's Safe",1976,agree
ISIL Beheads American Photojournalist in Iraq,903,discuss
"Woman detained in Lebanon is not al-Baghdadi's wife, Iraq says",1263,agree
"Report: The Apple Watch Will Only Last 2.5 Hours With ""Heavy"" Use",1477,discuss
"A message from Jim's mom, Diane Foley:",2067,agree
"Small meteorite strikes Nicaragua, government says",1795,unrelated
"Rare meteorite impact causes blast in Nicaragua's capital, Managua",269,unrelated
Does Vogue's New Office Have a Rat Infestation?,2064,discuss
ISIL video claims beheading of kidnapped journalist James Foley,847,discuss
"Batmobile stolen in Detroit? Good one, joker!",2135,agree
"So, There Might Be a Rat Infestation at Vogue",964,unrelated
"Woman detained in Lebanon is not al-Baghdadi's wife, Iraq says",1471,unrelated
'There is no limit to their depravity' Islamic State FEED mother her own SON,2526,unrelated
Update: Did Boston.com Make Up This Story About The Web Sheriff Ben Edelman Sending Racist Emails?,45,unrelated
"US Drones, Hunting for ISIS Leader, Seen Flying over Syrian Airspace",2443,discuss
"Hoax Alert: Father O’Neal, Who Has Met God and Thinks She’s a Woman, Is Made Up (Just Like God Herself)",1048,unrelated
"Kim Jong-un Broke Both Ankles and Is Hospitalized, Report Claims",505,unrelated
"Boko Haram Could Release Kidnapped Girls, Nigerian Officials Say",1372,unrelated
"Seven High School Girls Get Pregnant On Five-Day School Trip, Parents Outraged",2304,discuss
WATCH: Bird Launches Airstrike on Putin’s Shoulder (UPDATED),1789,unrelated
Fake Fox News Website Reports Judd Nelson’s Death for Some Reason,2481,unrelated
"Planetary Alignment On Jan 4, 2015 Will Decrease Gravity For 5 Minutes Causing Partial Weightlessness",26,unrelated
The pumpkin spice condom is not happening,1477,unrelated
Hundreds mourn the 'death' of Fidel Castro after rumours sweep Twitter (but are they confusing him with recently departed Fidel Castro Odinga from Nairobi?),1439,unrelated
6 hidden mass graves may hold missing Mexican students,761,unrelated
"North Korean leader Kim Jong Un had ankle surgery, report says",1296,discuss
"SEE IT: ISIS militants caught trying to cross border into Texas, Congressman claims",1637,unrelated
Boko Haram ceasefire ignored as violence flares in Borno state,1883,unrelated
Source: Tom Brokaw Wants Brian Williams Fired,1492,unrelated
NBC weatherman caught urinating in the woods live on air,860,unrelated
Everyone chill! Banksy has NOT been arrested,2412,unrelated
There was never a panel discussion on domestic violence planned for ESPN’s ‘Monday Night Football’ pregame show,373,unrelated
Militant Group Says It Killed American Journalist in Syria,7,unrelated
Canadian-Israeli Woman Says She Hasn’t Been Captured By ISIS,693,unrelated
Google Said to Buy Redwood City Offices for $585 Million,2442,discuss
Report: NYPD to stop arresting people for minor marijuana offenses,1802,discuss
Kurds fear Isis use of chemical weapon in Kobani,1737,unrelated
Reports: Boko Haram may release schoolgirls as part of deal,2520,unrelated
Official: Gitmo prisoner traded for Bergdahl reaching out to Taliban,2159,discuss
ISIS militants trick mother into ‘eating her kidnapped son’,1034,unrelated
iFixit Debunks iPhone 6 Plus Reinforcement Claims,387,unrelated
"North Korean leader Kim Jong-un not missing, just having ankle surgery",856,discuss
Google Grows With $1.6 Billion in California Office Deals,1034,unrelated
Saudi cleric says snowmen are anti-Islamic,924,agree
"Wildest Apple Watch rumor yet: 100,000 apps at launch",43,unrelated
Boyfriend cuts off his penis and throws it in the bin after girlfriend dumps him for being bad in bed,1933,unrelated
ISIS Fighters Getting Caught Coming Across the U.S.-Mexican Border?,1549,unrelated
BREAKING NEWS: Baseball star Jose Canseco hurt in accidental shooting,2266,unrelated
"Wife, child of Islamic State head Abu Bakr al-Baghdadi held in Lebanon, officials say",1789,unrelated
SEE IT: California homeless man uses $100 gift to give food to others,467,unrelated
"Pumpkin Spice Condoms, And 6 Other Flavors That Aren’t Happening",1642,unrelated
ISIS Claims to Have Intercepted Supplies From U.S. Airdrop,1363,discuss
Islamic State claims to have beheaded American journalist,2525,unrelated
"Boko Haram leader denies ceasefire deal, says 200 abducted girls married off ",34,unrelated
Has The Batman Vs. Superman Batmobile Been Stolen In Detroit?,2135,discuss
U.S. airstrike kills Islamic Al Shabab terrorist leader in Somalia,1982,discuss
Video: Marine survives Taliban sniper headshot thanks to helmet,634,unrelated
Married TV actor wakes up to find his testicles have been STOLEN after he is drugged in Russian bar by attractive blonde working for organ traffickers,1258,unrelated
6 Islamist militants killed in US attack in Somalia,1024,unrelated
Video shows ISIL beheading of photojournalist James Foley,2096,discuss
Libya: Missing Libya Planes Spark Security Concerns,1312,agree
WHO ‘probing’ whether ISIS fighters got Ebola,699,unrelated
HORROR: ISIS Fighters Have Reportedly Contracted Ebola,1689,discuss
UPDATE: BATMAN v SUPERMAN Batmobile Reportedly Stolen By (Shocker!) Detroit Locals,239,discuss
"Audio captured at time of Michael Brown shooting, company says",2317,discuss
Animal lovers abuzz over pope’s comments that 'paradise is open to all of God’s creatures',1835,unrelated
Tropical spider 'burrowed under man's skin through scar' - video report,1375,unrelated
Christian Bale in Talks to Play Steve Jobs (Exclusive),1646,unrelated
"Apple Media Event Rumored for Late February, Apple Watch and 12"" MacBook Air Likely Topics [Updated]",958,unrelated
Kim Jong-un: obese leader 'fractured both ankles',1480,discuss
Soldier shot near Canadian parliament building,950,unrelated
Jose Canseco Accidentally Shot Himself in the Hand,2000,discuss
Isis militants claim to have killed US journalist James Foley,1009,unrelated
Kim Jong-un 'Had Surgery on Fractured Ankles',2053,discuss
Web of confusion as scientists cast doubt on man's claims that a spider burrowed into his stomach through his SCAR,1819,disagree
ISLAMIC STATE BEHEADS MISSING AMERICAN JOURNALIST JAMES WRIGHT FOLEY,1966,agree
Amazon.com to open first physical store in Manhattan: DJ,1745,discuss
Ebola Outbreak 2015 Update: ISIS Fighters May Have Contracted Deadly Virus,2138,discuss
Nigerians doubtful of girls' release after Boko Haram 'truce' breached,1439,unrelated
India Rape Crisis Sees Mob Castrate Alleged Sex Attacker in Shocking Scenes,775,unrelated
WHO says reports of suspected Ebola cases in Iraq are untrue,1669,discuss
Is the Alleged Audio of the Gunshots That Killed Michael Brown a Hoax?,2220,discuss
Someone painted a graffiti dick on a $2.5 million car,2286,unrelated
Mohammed Emwazi: Man identified as Isis killer 'Jihadi John' was 'stopped by MI5' while on safari holiday in Africa in 2010,1427,unrelated
CNN Airs Alleged Audio from Michael Brown Shooting,1950,unrelated
There was never a panel discussion on domestic violence planned for ESPN’s ‘Monday Night Football’ pregame show,615,unrelated
Bergdahl: Senator Says Jihadists Swapped For U.S. Troop ‘In Touch’ With Al-Qaida Affiliate,1251,unrelated
Small red book among finds in 113-year-old Boston time capsule,2257,agree
Kim Jong-un 'so fat he has fractured his ankles',2141,unrelated
James Foley remembered as 'brave and tireless' journalist,933,discuss
Watch NAKED airport worker walk through scanner in bizarre protest against 'rough' guards,2070,unrelated
Audio may have captured Michael Brown shooting,1893,unrelated
CNN Posts Alleged Audio of Michael Brown Shooting,1893,unrelated
"SEE IT: ISIS militants caught trying to cross border into Texas, Congressman claims",1483,unrelated
Tropical spider burrowed under man's skin through appendix scar and lived there for THREE DAYS,1502,agree
Islamic State using 'SCORPION bombs' to terrorise victims,2257,unrelated
"UK spies identify Foley’s killer, Abdel-Majed Abdel Bary a key suspect",8,unrelated
"Rare Case: Seven Bosnian Girls, Aged 13 And 14, Fall Pregnant After Five-Day School Trip; Parents Outraged After School Cites 'Parental Neglect'",1385,unrelated
Dylan Thomas Finds Tropical Spider Burrowed Under Skin,1579,discuss
Christian Bale won't play Steve Jobs,975,unrelated
CNN Plays Alleged Audiotape of Michael Brown ShootingMilitarization Of Police,755,unrelated
Luke Somers' sister says he was killed in failed Yemen rescue attempt,2411,unrelated
Opposition group: ISIS militants training to fly warplanes in Syria,1406,unrelated
Jordan’s King May Participate Personally In ISIS Raids,1588,unrelated
"Comfort eating? Chinese woman, 26, spends an entire WEEK in KFC after being dumped by boyfriend",971,unrelated
"Jeh Johnson: Politicians Shouldn't 'Feed The Flames Of Fear' Over ISIS, Ebola",2458,unrelated
Iraqi media: ISIS militants have contracted Ebola,720,unrelated
Shots Heard In Alleged Brown Shooting Recording [AUDIO],2141,unrelated
"North Korea leader Kim is still in charge, has injured leg: source",2033,unrelated
Batmobile wasn't stolen: Cops,1338,unrelated
Saudi cleric says snowmen are anti-Islamic,1090,unrelated
The Apple Watch has a low-power mode that only tells the time,1157,unrelated
Islamic State Militants Claim to Have Beheaded US Journalist James Wright Foley,524,unrelated
ISIS: Desperate mum told 'you've just eaten your son' after visiting militants' base in search of kidnap victim,1956,discuss
Fears journalist James Wright Foley beheaded by Islamic State jihadists in ‘message’ to United States,1009,unrelated
Google Grows With $1.6 Billion in California Office Deals,2078,discuss
#HairGate: iPhone 6 Customers Are Complaining That The Phone Is Ripping Out Their Hair,161,unrelated
Christian Bale quits Steve Jobs movie,571,unrelated
Is Kim Jong Un's sister Kim Yo Jong in charge?,1760,unrelated
Anna Wintour: Is Rat Infestation At NYC ‘Vogue’ Office Kim Kardashian’s Fault?,2106,discuss
"Islamic State Training Pilots in Military Jets, Monitors Say",295,unrelated
ISIS Beheads American Journalist,511,unrelated
Guantanamo Detainee Exchanged for American POW Attempts a Return to Battle,209,discuss
Tiger Woods' agent shoots down report of failed drug test,17,unrelated
